1,723,723,NOW(),Morbi sed orci quis nunc posuere euismod eu id est.
1,724,724,NOW(),Mauris ut lorem eu nulla viverra pulvinar sit amet ut erat.
1,725,725,NOW(),Proin mollis orci imperdiet euismod tristique.
1,726,726,NOW(),Vestibulum vitae dolor at elit bibendum blandit id eget eros.
1,727,727,NOW(),Sed id diam id felis placerat placerat.
1,728,728,NOW(),Maecenas elementum libero tincidunt ultrices est eget hendrerit odio.
1,729,729,NOW(),Aenean euismod magna lacinia congue urna vel malesuada lacus.
1,730,730,NOW(),In in est euismod consectetur turpis ac elementum ligula.
1,731,731,NOW(),Phasellus consectetur quam ut nunc viverra semper tempor sem tristique.
1,732,732,NOW(),Cras varius mauris viverra justo lacinia et lacinia tortor cursus.
1,733,733,NOW(),Donec sit amet justo vel odio tincidunt faucibus in nec dolor.
1,734,734,NOW(),Sed ullamcorper nunc a lectus maximus ultrices.
1,735,735,NOW(),Maecenas laoreet lorem vitae fringilla finibus.
1,736,736,NOW(),Vestibulum ac quam et leo vulputate accumsan sit amet ac justo.
1,737,737,NOW(),Nam euismod mi vel tellus auctor gravida.
1,738,738,NOW(),Nulla consectetur mi ut dui auctor elementum.
1,739,739,NOW(),Pellentesque euismod nisl eget magna suscipit vitae vestibulum tellus laoreet.
1,740,740,NOW(),Nullam lobortis orci ut ligula efficitur euismod.
1,741,741,NOW(),Suspendisse at ipsum aliquam varius nibh auctor rhoncus odio.
1,742,742,NOW(),Mauris sagittis magna vitae lacus imperdiet ultricies sit amet in magna.
1,743,743,NOW(),Aenean molestie arcu id consectetur pharetra.
1,744,744,NOW(),Quisque vestibulum odio a augue ultrices non placerat eros volutpat.
1,745,745,NOW(),Duis dignissim lectus posuere neque lacinia ut consequat orci tempor.
1,746,746,NOW(),Donec rutrum purus eget viverra vulputate.
1,747,747,NOW(),Aliquam quis felis sed magna bibendum sodales sit amet non mauris.
1,748,748,NOW(),Vivamus accumsan nisl quis nibh egestas sollicitudin.
1,749,749,NOW(),Mauris eget tellus et nibh euismod mattis.
1,750,750,NOW(),Nulla ornare lacus sed facilisis scelerisque.
1,751,751,NOW(),Pellentesque et diam sodales tempor sem id sagittis ex.
1,752,752,NOW(),Ut tempus sapien ac purus dictum aliquam.
1,753,753,NOW(),Maecenas sed arcu ut ex bibendum fermentum sit amet mattis purus.
1,754,754,NOW(),Nam fermentum lorem at placerat pellentesque.
1,755,755,NOW(),Proin mollis eros eget mi sagittis maximus.
1,756,756,NOW(),Nam maximus quam commodo elementum iaculis.
1,757,757,NOW(),Morbi ac mauris condimentum elementum erat ut molestie risus.
1,758,758,NOW(),Aenean a urna nec diam tincidunt vehicula.
1,759,759,NOW(),Cras ac orci sagittis pulvinar felis id aliquet sapien.
1,760,760,NOW(),Maecenas mattis eros vitae lorem malesuada lacinia vel eu metus.
1,761,761,NOW(),Cras rutrum nunc ornare nulla condimentum vel tempor tortor consectetur.
1,762,762,NOW(),Vestibulum a justo et ipsum tempor elementum ac in orci.
1,763,763,NOW(),Pellentesque accumsan erat quis sem lobortis molestie.
1,764,764,NOW(),Mauris vulputate neque ut enim dictum ultricies.
1,765,765,NOW(),Nulla imperdiet libero id ultrices sodales.
1,766,766,NOW(),Vestibulum malesuada ante vitae commodo iaculis.
1,767,767,NOW(),Curabitur gravida dolor id mi porttitor mollis.
1,768,768,NOW(),Proin eu libero sit amet neque viverra pulvinar.
1,769,769,NOW(),Cras tincidunt nibh non dolor vestibulum a sagittis urna tincidunt.
1,770,770,NOW(),Vestibulum id orci sed felis eleifend sodales.
1,771,771,NOW(),Proin vehicula tellus et sem dictum quis cursus nunc fringilla.
1,772,772,NOW(),Morbi vel massa rutrum eleifend ligula sed sodales lacus.
1,773,773,NOW(),Curabitur iaculis sapien at quam tempus molestie.
1,774,774,NOW(),Pellentesque suscipit erat nec varius auctor.
1,775,775,NOW(),Nam quis arcu vitae nibh efficitur semper.
1,776,776,NOW(),Nullam mattis dolor eget felis condimentum rhoncus.
1,777,777,NOW(),In a nulla pretium ligula volutpat gravida in et est.
1,778,778,NOW(),Donec aliquet orci nec ligula hendrerit placerat.
1,779,779,NOW(),In lacinia arcu vitae sagittis varius.
1,780,780,NOW(),Aliquam mollis dolor sit amet tortor varius aliquet.
1,781,781,NOW(),Fusce aliquam lacus eget justo posuere convallis.
1,782,782,NOW(),Nullam eu tellus maximus porttitor magna ac semper libero.
1,783,783,NOW(),Vivamus varius augue at velit pharetra malesuada.
1,784,784,NOW(),Sed in massa dictum purus venenatis convallis.
1,785,785,NOW(),Praesent sit amet ex aliquam laoreet velit eu efficitur orci.
1,786,786,NOW(),Vestibulum nec mi in velit venenatis gravida ultrices nec ex.
1,787,787,NOW(),Mauris non velit nec ex malesuada pharetra.
1,788,788,NOW(),Cras quis mi commodo placerat nulla vitae varius augue.
1,789,789,NOW(),Nulla id ante commodo iaculis dui id eleifend dui.
1,790,790,NOW(),Nullam feugiat nisl ac pharetra tincidunt.
1,791,791,NOW(),In imperdiet quam eu consequat cursus.
1,792,792,NOW(),Sed tempus neque id pellentesque consectetur.
1,793,793,NOW(),In ut ipsum ac est scelerisque facilisis non varius eros.
1,794,794,NOW(),Morbi pharetra turpis ut tellus porttitor rhoncus.
1,795,795,NOW(),Quisque quis quam ac massa laoreet venenatis.
1,796,796,NOW(),Suspendisse nec sem eget ante semper laoreet.
1,797,797,NOW(),Sed vel ante at magna viverra molestie.
1,798,798,NOW(),Pellentesque commodo leo ut faucibus fermentum.
1,799,799,NOW(),Etiam a sapien vel eros venenatis laoreet sed sit amet dolor.
1,800,800,NOW(),Mauris blandit est a justo pretium eu tincidunt odio vestibulum.
1,801,801,NOW(),Nullam et tortor a nisi ultricies molestie volutpat vel sem.
1,802,802,NOW(),Fusce interdum ex in venenatis malesuada.
1,803,803,NOW(),Nulla imperdiet tellus sed nulla molestie id congue erat elementum.
1,804,804,NOW(),Donec dignissim arcu et ante iaculis nec fringilla augue suscipit.
1,805,805,NOW(),Fusce ac nibh convallis imperdiet tortor a blandit felis.
1,806,806,NOW(),Donec fermentum nunc at massa tempor posuere.
1,807,807,NOW(),Proin ut neque nec erat hendrerit pharetra.
1,808,808,NOW(),Vestibulum sed diam euismod felis posuere efficitur nec vitae ligula.
1,809,809,NOW(),In ac lectus nec ex vulputate ultricies.
1,810,810,NOW(),Vivamus facilisis risus sit amet maximus iaculis.
1,811,811,NOW(),Praesent suscipit nisi in bibendum lacinia.
1,812,812,NOW(),In ornare urna ut tincidunt mollis.
1,813,813,NOW(),Cras ultricies velit ut auctor volutpat.
1,814,814,NOW(),Nulla eget nulla eu ipsum rutrum fermentum.
1,815,815,NOW(),Vestibulum fringilla orci quis mauris auctor in interdum lacus ultricies.
1,816,816,NOW(),Quisque semper neque sed ligula varius vulputate.
1,817,817,NOW(),Duis pulvinar enim vel ligula posuere pharetra.
1,818,818,NOW(),Donec laoreet elit sed semper dignissim.
1,819,819,NOW(),Aliquam ornare ipsum vitae tortor lobortis convallis.
1,820,820,NOW(),Nulla hendrerit purus at turpis hendrerit in pulvinar tellus fermentum.
1,821,821,NOW(),Pellentesque cursus nisi nec sem convallis faucibus.
1,822,822,NOW(),Donec euismod nibh non nibh pellentesque eget congue libero fringilla.
1,823,823,NOW(),In sit amet mi pretium imperdiet est a tempus massa.
1,824,824,NOW(),Proin suscipit ex in auctor pretium.
1,825,825,NOW(),Nunc volutpat nunc et posuere euismod.
1,826,826,NOW(),Sed eget justo et neque facilisis dignissim.
1,827,827,NOW(),Integer quis augue vehicula pretium nibh at porttitor velit.
1,828,828,NOW(),Maecenas semper eros in lectus ultricies tincidunt.
1,829,829,NOW(),Proin quis lacus cursus orci dignissim posuere.
1,830,830,NOW(),Aliquam venenatis felis et mi consequat rhoncus.
1,831,831,NOW(),Aenean ultrices metus et mollis imperdiet.
1,832,832,NOW(),Mauris ut nibh eget mauris elementum pulvinar nec et est.
1,833,833,NOW(),Fusce nec justo eu diam luctus aliquet vitae sit amet nunc.
1,834,834,NOW(),Vestibulum volutpat metus sit amet tellus porttitor placerat at id urna.
1,835,835,NOW(),Phasellus dictum felis mattis sem cursus at ultrices ligula bibendum.
1,836,836,NOW(),Praesent tristique risus vel lectus ullamcorper aliquet.
1,837,837,NOW(),Etiam ac nisl sit amet nunc placerat dignissim.
1,838,838,NOW(),Nullam nec ex non est consequat luctus vitae ut ipsum.
1,839,839,NOW(),Pellentesque porta magna id cursus cursus.
1,840,840,NOW(),Pellentesque sit amet turpis sed diam luctus sodales.
1,841,841,NOW(),Curabitur sit amet est quis augue dapibus aliquet ut et eros.
1,842,842,NOW(),Morbi elementum tortor non dolor tempor tristique.
1,843,843,NOW(),In ac ex at felis elementum blandit.
1,844,844,NOW(),Nullam sed velit ornare ornare magna consectetur tincidunt libero.
1,845,845,NOW(),Curabitur eget erat eu odio posuere ultrices tincidunt vitae nisl.
1,846,846,NOW(),Proin et ligula nec nisi porttitor commodo.
1,847,847,NOW(),Integer in erat a velit molestie blandit.
1,848,848,NOW(),Sed interdum elit sit amet lectus euismod sit amet posuere nisl consectetur.
1,849,849,NOW(),Integer accumsan erat quis enim commodo sollicitudin ut at orci.
1,850,850,NOW(),Cras iaculis risus non turpis cursus faucibus sed at mauris.
1,851,851,NOW(),Aenean et leo at turpis tempor feugiat at vitae odio.
1,852,852,NOW(),Suspendisse tristique eros id nisi volutpat pellentesque.
1,853,853,NOW(),Nulla quis ex fringilla imperdiet orci sed sodales diam.
1,854,854,NOW(),Donec sollicitudin est sit amet nisi ultrices aliquam.
1,855,855,NOW(),Aliquam vel ante congue mi placerat condimentum eu quis libero.
1,856,856,NOW(),In porttitor mi vel tortor ultrices finibus.
1,857,857,NOW(),Ut finibus tortor vitae leo fermentum consectetur.
1,858,858,NOW(),Donec nec lectus vel magna venenatis vestibulum.
1,859,859,NOW(),Nulla in nulla facilisis blandit purus ac viverra nulla.
1,860,860,NOW(),Phasellus in metus cursus mauris porttitor tristique in non massa.
1,861,861,NOW(),Aenean posuere ante at maximus molestie.
1,862,862,NOW(),Sed molestie sem in iaculis commodo.
1,863,863,NOW(),Ut bibendum odio vel odio dapibus ultrices.
1,864,864,NOW(),Curabitur sit amet ligula quis massa facilisis efficitur ac non justo.
1,865,865,NOW(),Integer lobortis est eget turpis elementum sagittis.
1,866,866,NOW(),Suspendisse a dui ac massa sagittis tempus.
1,867,867,NOW(),Aenean mollis enim vitae eleifend pharetra.
1,868,868,NOW(),Donec gravida nulla id ipsum scelerisque non commodo ante elementum.
1,869,869,NOW(),Suspendisse sed felis vitae eros mattis sodales sit amet eu diam.
1,870,870,NOW(),Aenean finibus eros et lorem efficitur non efficitur mauris tempus.
1,871,871,NOW(),Pellentesque condimentum orci eget tempor sagittis.
1,872,872,NOW(),Sed pellentesque est vel libero ullamcorper tristique.
1,873,873,NOW(),Duis sit amet odio vitae quam mattis vulputate.
1,874,874,NOW(),Donec ut diam mollis malesuada dui quis dapibus elit.
1,875,875,NOW(),Praesent et lectus id tortor pharetra luctus.
1,876,876,NOW(),Nunc in neque quis purus ultricies vehicula a rhoncus sapien.
1,877,877,NOW(),Vivamus eget nibh varius suscipit mi in convallis velit.
1,878,878,NOW(),Integer ac mi ultrices faucibus turpis ac bibendum sem.
1,879,879,NOW(),Etiam id arcu non magna vulputate facilisis eget id tellus.
1,880,880,NOW(),Fusce tristique urna sed tortor faucibus imperdiet bibendum dui rhoncus.
1,881,881,NOW(),Donec pretium turpis sit amet turpis iaculis varius.
1,882,882,NOW(),Proin et sem iaculis pulvinar elit quis finibus purus.
1,883,883,NOW(),Integer sed enim pulvinar egestas orci eu cursus nisl.
1,884,884,NOW(),Nullam vel nunc sed arcu cursus placerat quis feugiat nisi.
1,885,885,NOW(),Curabitur rutrum quam vitae congue molestie.
1,886,886,NOW(),Ut porta risus non nisl rutrum eleifend.
1,887,887,NOW(),Pellentesque nec est viverra fringilla nulla quis ultricies urna.
1,888,888,NOW(),Integer mollis nibh ut velit pulvinar dictum commodo nibh convallis.
1,889,889,NOW(),Donec ac nibh eu neque facilisis facilisis.
1,890,890,NOW(),Morbi finibus libero et metus dictum eget facilisis odio sagittis.
1,891,891,NOW(),Quisque euismod neque nec diam tempus aliquet.
1,892,892,NOW(),Nullam quis nisi vel lorem iaculis mollis sed vel ante.
1,893,893,NOW(),Pellentesque eget ipsum vulputate libero pharetra elementum.
1,894,894,NOW(),Duis a velit in nisi vehicula ornare vitae ut mauris.
1,895,895,NOW(),Vestibulum vel quam volutpat vehicula ex vel venenatis nisi.
1,896,896,NOW(),Morbi facilisis felis eget imperdiet ullamcorper.
1,897,897,NOW(),In non purus dictum feugiat neque et efficitur nunc.
1,898,898,NOW(),Nullam bibendum nisi vitae nisi luctus blandit.
1,899,899,NOW(),Integer eu arcu nec eros faucibus aliquam rhoncus at urna.
1,900,900,NOW(),Vivamus ac magna pharetra finibus erat nec imperdiet odio.
1,901,901,NOW(),Suspendisse tempor est a neque gravida in mattis eros ornare.
1,902,902,NOW(),Suspendisse malesuada sapien id quam vulputate sit amet euismod augue pellentesque.
1,903,903,NOW(),Nulla id justo id arcu pretium tempus.
1,904,904,NOW(),Morbi nec mi vel tortor malesuada posuere.
1,905,905,NOW(),Donec auctor libero ut velit convallis vulputate venenatis felis cursus.
1,906,906,NOW(),Vestibulum vel est non enim tincidunt commodo ac auctor tortor.
1,907,907,NOW(),Ut id leo sed leo bibendum mollis id tristique dui.
1,908,908,NOW(),Nunc porta augue eget turpis varius efficitur vel sit amet magna.
1,909,909,NOW(),Duis eget justo quis ligula semper ullamcorper.
1,910,910,NOW(),Nullam aliquam orci in convallis sagittis.
1,911,911,NOW(),Cras pulvinar nisi eget enim tincidunt eleifend tincidunt nulla vehicula.
1,912,912,NOW(),Mauris accumsan justo nec dapibus tristique.
1,913,913,NOW(),Duis feugiat enim dapibus nibh vulputate at tempor tellus viverra.
1,914,914,NOW(),Proin molestie odio at porttitor congue.
1,915,915,NOW(),Sed ultrices tortor in justo suscipit et imperdiet dolor tristique.
1,916,916,NOW(),Duis nec tortor sit amet mi auctor cursus ac vel justo.
1,917,917,NOW(),Nunc interdum felis vitae fringilla facilisis.
1,918,918,NOW(),Morbi eu tortor eu enim pretium cursus ut nec nibh.
1,919,919,NOW(),Aliquam iaculis nulla sed augue finibus tristique.
1,920,920,NOW(),Sed imperdiet sapien eu justo aliquet scelerisque.
1,921,921,NOW(),Praesent non eros sed diam convallis commodo sed sed purus.
1,922,922,NOW(),Integer semper erat ac nibh dapibus tincidunt.
1,923,923,NOW(),Nullam semper metus eget lacus fermentum ac laoreet nibh tristique.
1,924,924,NOW(),Duis venenatis turpis sit amet leo pretium mattis.
1,925,925,NOW(),Integer non ante quis felis imperdiet euismod.
1,926,926,NOW(),Suspendisse lacinia quam nec nulla tempus ut maximus lacus accumsan.
1,927,927,NOW(),Fusce quis est nec justo laoreet dignissim.
1,928,928,NOW(),Sed sodales augue non augue consequat non blandit metus volutpat.
1,929,929,NOW(),Sed a diam interdum nisl mattis tristique.
1,930,930,NOW(),Donec dignissim metus sit amet lacus rutrum vitae varius odio porttitor.
1,931,931,NOW(),Donec pellentesque enim at rutrum pharetra.
1,932,932,NOW(),Morbi eleifend odio nec nunc tincidunt tempus.
1,933,933,NOW(),Nunc bibendum metus in urna ornare bibendum.
1,934,934,NOW(),Aenean fringilla lorem a turpis scelerisque aliquam.
1,935,935,NOW(),Aliquam pretium metus at dignissim suscipit.
1,936,936,NOW(),Fusce ac nisl sit amet ipsum scelerisque vehicula.
1,937,937,NOW(),Suspendisse et felis vitae nunc porta tincidunt vitae non massa.
1,938,938,NOW(),Donec tincidunt mi nec orci vestibulum placerat.
1,939,939,NOW(),Quisque facilisis leo lacinia massa elementum tristique.
1,940,940,NOW(),Mauris commodo mauris nec tortor luctus ac hendrerit ante rutrum.
1,941,941,NOW(),Nulla euismod eros in est vestibulum eget euismod quam molestie.
1,942,942,NOW(),Fusce rutrum sapien id tortor tempus sollicitudin.
1,943,943,NOW(),Mauris egestas diam a porta rutrum.
1,944,944,NOW(),Donec tempor felis at interdum tempor.
1,945,945,NOW(),Fusce id est ut justo vulputate vestibulum.
1,946,946,NOW(),Nulla eu justo ultricies luctus urna vitae vehicula elit.
1,947,947,NOW(),Nam vestibulum ante sed dignissim imperdiet.
1,948,948,NOW(),Fusce a nibh pulvinar dui tincidunt commodo.
1,949,949,NOW(),Nunc ac neque porta scelerisque nisl id iaculis lacus.
1,950,950,NOW(),Ut ultricies sapien nec felis scelerisque finibus.
1,951,951,NOW(),Duis malesuada tortor eleifend dui tincidunt ullamcorper.
1,952,952,NOW(),Morbi vitae purus at diam tincidunt consequat.
1,953,953,NOW(),Nunc ornare augue vitae tincidunt iaculis.
1,954,954,NOW(),Sed in felis at ex egestas ullamcorper et vel lectus.
1,955,955,NOW(),Sed rutrum urna ac ante sollicitudin in eleifend enim dignissim.
1,956,956,NOW(),Aenean hendrerit neque finibus sollicitudin tristique.
1,957,957,NOW(),Quisque sit amet odio sit amet metus convallis interdum ac sed leo.
1,958,958,NOW(),Maecenas accumsan enim congue venenatis luctus.
1,959,959,NOW(),Phasellus dignissim nunc in urna fermentum pharetra.
1,960,960,NOW(),Vivamus molestie sem vitae mauris tempus dictum.
1,961,961,NOW(),Sed dapibus mi nec sem rutrum eu imperdiet nulla tempus.
1,962,962,NOW(),Praesent pulvinar arcu bibendum nisi tempor quis convallis felis iaculis.
1,963,963,NOW(),Donec ac velit eleifend pretium nisl ac mattis leo.
1,964,964,NOW(),Phasellus ut lorem ac ligula tempus pulvinar.
1,965,965,NOW(),Nunc porttitor dolor vitae dictum lacinia.
1,966,966,NOW(),Duis elementum nibh lobortis leo faucibus ultricies.
1,967,967,NOW(),Mauris a tortor varius lobortis massa et placerat orci.
1,968,968,NOW(),Nam a orci ultricies venenatis nisi pellentesque mollis dui.
1,969,969,NOW(),Maecenas id tortor quis risus venenatis ultrices ac in est.
1,970,970,NOW(),In fermentum ligula quis tortor tristique eget tincidunt ex commodo.
1,971,971,NOW(),Nam commodo diam vel diam malesuada convallis.
1,972,972,NOW(),Proin in tortor sit amet ligula efficitur maximus nec sed libero.
1,973,973,NOW(),Aenean molestie orci vitae metus tempus eget cursus turpis gravida.
1,974,974,NOW(),Proin ullamcorper orci nec urna gravida elementum.
1,975,975,NOW(),Curabitur at orci sed ante sodales commodo vitae id tortor.
1,976,976,NOW(),Vestibulum eget mi vitae erat ultricies venenatis convallis vitae diam.
1,977,977,NOW(),Maecenas sed urna pharetra ornare lectus sed dignissim quam.
1,978,978,NOW(),In vehicula diam eget tristique rutrum.
1,979,979,NOW(),Quisque varius mauris eu sem vulputate malesuada.
1,980,980,NOW(),Praesent et lectus quis erat hendrerit blandit.
1,981,981,NOW(),Duis auctor enim nec ipsum volutpat malesuada.
1,982,982,NOW(),Morbi sed est eu nisl vestibulum porttitor.
1,983,983,NOW(),Nunc vitae dolor convallis semper turpis eget pulvinar justo.
1,984,984,NOW(),Nunc non quam nec lorem aliquet ornare.
1,985,985,NOW(),Praesent pellentesque diam in fermentum vehicula.
1,986,986,NOW(),Donec quis sem lacinia nisi fermentum posuere.
1,987,987,NOW(),Fusce finibus ex at ante tempor accumsan.
1,988,988,NOW(),Integer et est laoreet euismod neque sed interdum ante.
1,989,989,NOW(),Aenean eu augue at nunc ultricies posuere.
1,990,990,NOW(),Aenean rutrum mi eget lacus tempor feugiat.
1,991,991,NOW(),Morbi convallis eros in purus hendrerit mattis.
1,992,992,NOW(),Ut aliquam sem at scelerisque pellentesque.
1,993,993,NOW(),Aliquam et ligula ut est venenatis pulvinar quis at tellus.
1,994,994,NOW(),Fusce sit amet est nec nisl faucibus posuere.
1,995,995,NOW(),Aenean vitae ex viverra ante pellentesque elementum vel eget sapien.
1,996,996,NOW(),In eget est aliquet commodo felis efficitur hendrerit risus.
1,997,997,NOW(),Aliquam sagittis felis sit amet imperdiet molestie.
1,998,998,NOW(),Praesent eget nisl at ex vestibulum iaculis eu id eros.
1,999,999,NOW(),Aliquam congue ante ac rhoncus sagittis.
1,1000,1000,NOW(),Sed eu tortor a enim ullamcorper placerat vel rhoncus neque.
1,1001,1,NOW(),Nunc sit amet eros at tellus iaculis egestas.
1,1002,2,NOW(),Morbi rhoncus dui quis lacus semper semper tempus odio bibendum.
1,1003,3,NOW(),Suspendisse eleifend orci at ex ultrices semper.
1,1004,4,NOW(),Maecenas porta ante eget lectus commodo tempus.
1,1005,5,NOW(),Morbi laoreet eros quis dui vestibulum ut condimentum odio elementum.
1,1006,6,NOW(),Curabitur aliquet enim vel convallis semper.
1,1007,7,NOW(),Duis tempus tortor sit amet metus pharetra eget porttitor lacus finibus.
1,1008,8,NOW(),Sed nec dolor vel felis accumsan mattis sed eget massa.
1,1009,9,NOW(),Praesent tristique augue vitae eros elementum sit amet malesuada nisi iaculis.
1,1010,10,NOW(),Curabitur eget massa id ex ultrices ornare in nec arcu.
1,1011,11,NOW(),Cras tincidunt nibh vel odio tempor sit amet suscipit justo malesuada.
1,1012,12,NOW(),Curabitur ut nibh eget nulla eleifend placerat quis ac arcu.
1,1013,13,NOW(),Integer vel erat et metus bibendum vehicula nec eget leo.
1,1014,14,NOW(),Donec semper odio vel nibh dapibus fermentum.
1,1015,15,NOW(),Praesent porta metus id lacinia molestie.
1,1016,16,NOW(),Mauris eu libero in mauris dictum venenatis.
1,1017,17,NOW(),Nam id odio at ex commodo tempus in ac mauris.
1,1018,18,NOW(),In quis libero egestas dignissim erat et blandit libero.
1,1019,19,NOW(),Cras finibus metus sit amet lectus blandit malesuada.
1,1020,20,NOW(),Maecenas id arcu pellentesque dictum velit a maximus dolor.
1,1021,21,NOW(),Praesent sed sem et mauris dignissim dignissim.
1,1022,22,NOW(),Praesent aliquam orci id semper interdum.
1,1023,23,NOW(),Donec a magna commodo aliquam tellus ac consectetur nisi.
1,1024,24,NOW(),Aliquam congue quam id quam volutpat id finibus purus semper.
1,1025,25,NOW(),Lorem ipsum dolor sit amet consectetur adipiscing elit.
1,1026,26,NOW(),Nulla volutpat nisi nec lectus facilisis feugiat.
1,1027,27,NOW(),Aenean eu libero vitae mi venenatis interdum.
1,1028,28,NOW(),Pellentesque ac lectus quis enim maximus aliquam ultrices at augue.
1,1029,29,NOW(),Duis vitae dolor quis ipsum molestie porta ut pulvinar lorem.
1,1030,30,NOW(),Donec egestas lectus id justo bibendum interdum.
1,1031,31,NOW(),Aliquam eu sapien molestie ultricies nunc vitae pellentesque tortor.
1,1032,32,NOW(),Donec sagittis mauris a dolor aliquet euismod.
1,1033,33,NOW(),Nunc rhoncus augue vel turpis consequat sollicitudin.
1,1034,34,NOW(),Pellentesque in massa a est consectetur feugiat eget et libero.
1,1035,35,NOW(),Praesent at risus ac massa ultrices efficitur euismod in turpis.
1,1036,36,NOW(),Suspendisse consectetur elit nec erat dictum tincidunt.
1,1037,37,NOW(),Aliquam sodales neque id ligula pellentesque tincidunt.
1,1038,38,NOW(),Maecenas tempor ex in odio bibendum eget imperdiet nisl lacinia.
1,1039,39,NOW(),Nam sed augue venenatis porttitor nibh eget porta orci.
1,1040,40,NOW(),Nulla dignissim ex in dolor mattis molestie commodo enim interdum.
1,1041,41,NOW(),Maecenas aliquet est ut luctus sodales.
1,1042,42,NOW(),Quisque finibus sapien sit amet enim elementum dapibus.
1,1043,43,NOW(),Nam id ligula nec mi viverra porttitor non eget nisl.
1,1044,44,NOW(),Suspendisse quis magna ut arcu gravida blandit.
1,1045,45,NOW(),Maecenas vehicula urna eu felis consectetur laoreet.
1,1046,46,NOW(),Nunc congue tellus quis sapien molestie eget vulputate sem dignissim.
1,1047,47,NOW(),Aenean vel lectus ullamcorper elementum justo in sollicitudin elit.
1,1048,48,NOW(),Vivamus quis urna rhoncus faucibus mauris volutpat pharetra nibh.
1,1049,49,NOW(),Nulla et neque placerat maximus metus nec condimentum ex.
1,1050,50,NOW(),Mauris ornare ligula nec tempus tincidunt.
1,1051,51,NOW(),Integer hendrerit tortor at tincidunt dignissim.
1,1052,52,NOW(),Donec pulvinar enim sit amet tincidunt elementum.
1,1053,53,NOW(),Nullam interdum libero quis diam vulputate eu fermentum est interdum.
1,1054,54,NOW(),Aliquam facilisis nunc id lobortis finibus.
1,1055,55,NOW(),Phasellus imperdiet sapien id facilisis molestie.
1,1056,56,NOW(),Nullam hendrerit magna nec felis imperdiet mattis.
1,1057,57,NOW(),Duis tempus elit vitae dictum bibendum.
1,1058,58,NOW(),Curabitur mattis odio et lorem euismod ac rhoncus lacus tristique.
1,1059,59,NOW(),Pellentesque at nisl ac magna vehicula venenatis.
1,1060,60,NOW(),Fusce nec ipsum sagittis efficitur leo a rutrum nunc.
1,1061,61,NOW(),Nunc et nunc semper suscipit urna non ullamcorper ante.
1,1062,62,NOW(),Praesent eget felis commodo venenatis nunc ut sollicitudin magna.
1,1063,63,NOW(),Sed vehicula ipsum id risus convallis sed ultricies orci auctor.
1,1064,64,NOW(),Vivamus et nibh lacinia dapibus sem dapibus luctus justo.
1,1065,65,NOW(),Suspendisse a tortor condimentum interdum enim eget ornare orci.
1,1066,66,NOW(),Curabitur semper erat nec commodo convallis.
1,1067,67,NOW(),Mauris pharetra odio sit amet vehicula auctor.
1,1068,68,NOW(),Donec sollicitudin nibh non tellus finibus a cursus tellus accumsan.
1,1069,69,NOW(),Pellentesque in justo ut lectus accumsan faucibus.
1,1070,70,NOW(),Fusce commodo magna at consequat mollis.
1,1071,71,NOW(),Mauris consectetur odio ut nunc ultricies viverra.
1,1072,72,NOW(),Ut molestie velit non justo fringilla quis fringilla erat fermentum.
1,1073,73,NOW(),Maecenas vel dui in tellus rutrum aliquam at sit amet nunc.
1,1074,74,NOW(),Donec vitae dolor a est eleifend varius eget at dolor.
1,1075,75,NOW(),Etiam nec lorem vel augue malesuada placerat vel non elit.
1,1076,76,NOW(),Proin in ipsum commodo luctus magna sit amet sodales velit.
1,1077,77,NOW(),Nam vitae lectus condimentum luctus tellus eget malesuada urna.
1,1078,78,NOW(),Donec tincidunt ipsum vitae mollis malesuada.
1,1079,79,NOW(),Maecenas eget nunc feugiat euismod urna quis congue nisl.
1,1080,80,NOW(),Nulla id justo vel libero tincidunt imperdiet a et nibh.
1,1081,81,NOW(),Nam vitae augue eu nunc tempus efficitur.
1,1082,82,NOW(),Suspendisse sed risus hendrerit dictum libero sed accumsan diam.
1,1083,83,NOW(),Pellentesque tempus dolor nec velit suscipit interdum.
1,1084,84,NOW(),Morbi lacinia purus vitae orci pulvinar sed aliquam lacus maximus.
1,1085,85,NOW(),Vivamus convallis odio ut rhoncus tristique.
