1,366,366,NOW(),Cras sed nulla pretium fringilla sapien non auctor turpis.
1,367,367,NOW(),In sed justo vel lectus posuere condimentum.
1,368,368,NOW(),Maecenas et diam at diam convallis ornare.
1,369,369,NOW(),Praesent accumsan arcu vel tempus rhoncus.
1,370,370,NOW(),Duis ut mi lobortis odio cursus fringilla a eget velit.
1,371,371,NOW(),Sed sit amet erat eget nisi finibus tempor.
1,372,372,NOW(),Nam sagittis arcu ut magna lacinia quis dictum ipsum luctus.
1,373,373,NOW(),Duis et tellus mattis mattis augue ut auctor nibh.
1,374,374,NOW(),Fusce placerat risus auctor ligula rutrum bibendum.
1,375,375,NOW(),Maecenas mollis nisl a pretium euismod.
1,376,376,NOW(),Aliquam vitae nisi interdum varius metus ut vestibulum dui.
1,377,377,NOW(),Curabitur et libero ac metus rutrum vulputate id scelerisque diam.
1,378,378,NOW(),Donec dapibus arcu et facilisis aliquet.
1,379,379,NOW(),Nam a arcu id leo sagittis accumsan in in elit.
1,380,380,NOW(),Aliquam eget sapien ultricies pretium eros ac efficitur ligula.
1,381,381,NOW(),Quisque mattis massa vel ipsum mollis varius.
1,382,382,NOW(),Proin sed elit convallis tempus nisl at dapibus massa.
1,383,383,NOW(),Quisque vel libero sit amet turpis sagittis maximus.
1,384,384,NOW(),Praesent elementum ligula a efficitur volutpat.
1,385,385,NOW(),Nullam tempor elit nec lacus vulputate iaculis.
1,386,386,NOW(),Aliquam condimentum eros eu elementum egestas.
1,387,387,NOW(),Nulla placerat eros vitae aliquam cursus.
1,388,388,NOW(),Aliquam vitae eros dignissim rhoncus urna vel tincidunt mi.
1,389,389,NOW(),Nullam a felis in est fringilla dictum.
1,390,390,NOW(),Donec quis lectus sed purus tincidunt congue.
1,391,391,NOW(),Nam eget ante quis diam tincidunt volutpat.
1,392,392,NOW(),Vestibulum sodales arcu dictum venenatis arcu nec fermentum enim.
1,393,393,NOW(),Proin accumsan elit porta elementum sollicitudin.
1,394,394,NOW(),Suspendisse rhoncus magna a purus convallis at mattis ipsum molestie.
1,395,395,NOW(),Nam vel metus eget ex maximus semper non et justo.
1,396,396,NOW(),Nunc molestie velit ut tortor mollis tincidunt.
1,397,397,NOW(),Sed blandit nibh sit amet sodales eleifend.
1,398,398,NOW(),Aenean ut diam ac tortor accumsan consectetur ut in metus.
1,399,399,NOW(),Aliquam pretium sem vel justo ullamcorper tempus.
1,400,400,NOW(),Donec cursus ex in sem facilisis dapibus.
1,401,401,NOW(),Vestibulum venenatis nunc at erat consectetur porttitor.
1,402,402,NOW(),Nam eget leo a tellus dapibus sodales eget sit amet ante.
1,403,403,NOW(),Fusce mollis mauris sed nunc porttitor tempor.
1,404,404,NOW(),Curabitur sit amet massa blandit cursus est id tincidunt nulla.
1,405,405,NOW(),Ut dignissim nulla vitae quam tempus vitae efficitur quam luctus.
1,406,406,NOW(),Nunc fringilla diam vel accumsan volutpat.
1,407,407,NOW(),Aliquam hendrerit nisi ac libero egestas non auctor tellus posuere.
1,408,408,NOW(),Nam eget arcu maximus aliquam felis ac blandit risus.
1,409,409,NOW(),Duis finibus ipsum quis neque consectetur volutpat.
1,410,410,NOW(),Cras mattis arcu gravida mauris commodo non placerat tortor porta.
1,411,411,NOW(),Nullam at nibh pulvinar vehicula ipsum rhoncus bibendum nisl.
1,412,412,NOW(),Morbi congue turpis sed nulla tempus vel pellentesque sem tincidunt.
1,413,413,NOW(),Vivamus et dui ut nunc condimentum vulputate ut at nulla.
1,414,414,NOW(),Duis quis eros fringilla pellentesque elit quis ultrices turpis.
1,415,415,NOW(),Ut dapibus dui sed nisl rutrum vehicula.
1,416,416,NOW(),Nam viverra dolor id nibh lobortis dapibus.
1,417,417,NOW(),Cras dictum mi non commodo pretium.
1,418,418,NOW(),Donec at elit egestas commodo lectus eget convallis sem.
1,419,419,NOW(),Nunc vitae dolor eget ipsum commodo varius nec id eros.
1,420,420,NOW(),Ut in lectus ut est venenatis congue.
1,421,421,NOW(),Integer convallis nisl eget metus scelerisque ac tristique libero dignissim.
1,422,422,NOW(),Duis posuere nibh quis sem vulputate aliquet.
1,423,423,NOW(),Nam fermentum velit eu nisi varius a fermentum nibh sodales.
1,424,424,NOW(),Maecenas ultricies velit id nunc consectetur non efficitur libero fringilla.
1,425,425,NOW(),Donec at nibh dignissim sapien efficitur rhoncus.
1,426,426,NOW(),Aenean malesuada eros ac nisi hendrerit efficitur tempus lectus scelerisque.
1,427,427,NOW(),Donec iaculis augue in egestas eleifend.
1,428,428,NOW(),Ut laoreet magna a turpis aliquet blandit.
1,429,429,NOW(),Vivamus id ligula scelerisque fermentum eros nec congue odio.
1,430,430,NOW(),Nunc scelerisque ex vel libero tempus bibendum at ac mauris.
1,431,431,NOW(),Vivamus quis nisi vel lorem venenatis cursus mattis at risus.
1,432,432,NOW(),Nunc facilisis nisi non lorem tempus bibendum.
1,433,433,NOW(),Suspendisse vulputate enim ac tortor lobortis nec hendrerit mauris elementum.
1,434,434,NOW(),Curabitur interdum elit at nisl laoreet imperdiet eget et metus.
1,435,435,NOW(),Morbi vestibulum diam id lobortis pretium.
1,436,436,NOW(),Mauris mollis erat id neque luctus pellentesque.
1,437,437,NOW(),Integer a massa sit amet ante ornare faucibus.
1,438,438,NOW(),Praesent et lacus dignissim enim malesuada egestas.
1,439,439,NOW(),Cras sed tellus vitae diam faucibus suscipit ac dignissim tortor.
1,440,440,NOW(),Praesent id tellus sagittis elementum felis quis rhoncus urna.
1,441,441,NOW(),Phasellus vulputate mi vitae metus luctus condimentum dictum enim consectetur.
1,442,442,NOW(),Vivamus vel neque porta condimentum lacus et volutpat turpis.
1,443,443,NOW(),Aliquam laoreet metus fringilla scelerisque arcu ac egestas ipsum.
1,444,444,NOW(),Nunc non libero pharetra lacinia mi in gravida sapien.
1,445,445,NOW(),Sed ut tortor ut felis iaculis tincidunt et viverra elit.
1,446,446,NOW(),Nulla porttitor massa molestie odio imperdiet in commodo eros consequat.
1,447,447,NOW(),Aenean congue quam nec fringilla commodo.
1,448,448,NOW(),Praesent luctus magna eu convallis scelerisque.
1,449,449,NOW(),Curabitur lobortis est rutrum sem egestas pulvinar.
1,450,450,NOW(),Sed ultrices sem pharetra felis congue maximus.
1,451,451,NOW(),Etiam gravida quam ac nunc eleifend elementum.
1,452,452,NOW(),Proin ultricies lacus sodales risus cursus vel commodo erat pretium.
1,453,453,NOW(),In sit amet urna aliquet fermentum nunc eu gravida enim.
1,454,454,NOW(),Suspendisse ultrices erat a libero varius vel finibus felis sagittis.
1,455,455,NOW(),Fusce lacinia lorem eu iaculis sollicitudin.
1,456,456,NOW(),Pellentesque ornare nibh vitae tellus ullamcorper sed tempus augue aliquam.
1,457,457,NOW(),Maecenas condimentum nibh vitae accumsan ornare.
1,458,458,NOW(),Suspendisse eu velit maximus rhoncus nulla sit amet egestas velit.
1,459,459,NOW(),Nulla ac lacus consectetur egestas sapien aliquet efficitur odio.
1,460,460,NOW(),Pellentesque sit amet purus et libero molestie ultricies vitae ac erat.
1,461,461,NOW(),Mauris ut risus egestas pretium nulla tincidunt convallis nunc.
1,462,462,NOW(),Praesent vehicula neque in dolor pharetra sed sagittis enim varius.
1,463,463,NOW(),Praesent imperdiet tortor vel blandit pulvinar.
1,464,464,NOW(),Vivamus ultrices tellus id laoreet vehicula.
1,465,465,NOW(),In at eros elementum diam pulvinar congue.
1,466,466,NOW(),Aenean pharetra massa at quam gravida viverra.
1,467,467,NOW(),Nam eu purus porta molestie urna sit amet interdum dolor.
1,468,468,NOW(),Suspendisse ullamcorper ipsum sed massa malesuada sed vulputate ipsum suscipit.
1,469,469,NOW(),Vivamus eget enim sit amet arcu pretium venenatis vel quis ipsum.
1,470,470,NOW(),Vestibulum luctus eros aliquam erat ornare mollis euismod ipsum accumsan.
1,471,471,NOW(),Donec ac tellus facilisis vulputate justo eget faucibus velit.
1,472,472,NOW(),Morbi ultrices purus accumsan ante aliquet quis dictum orci dictum.
1,473,473,NOW(),Vestibulum ac velit sed purus luctus interdum ut at ante.
1,474,474,NOW(),Aliquam gravida elit ullamcorper nisl ullamcorper convallis.
1,475,475,NOW(),Proin laoreet diam id urna semper id tempor risus condimentum.
1,476,476,NOW(),Aliquam a justo at tortor tempus sollicitudin.
1,477,477,NOW(),Vivamus a elit sed lacus posuere dictum.
1,478,478,NOW(),Cras in est lobortis malesuada sem et consectetur tellus.
1,479,479,NOW(),Etiam imperdiet velit eu sodales porttitor.
1,480,480,NOW(),Suspendisse dictum urna in felis scelerisque nec placerat magna congue.
1,481,481,NOW(),Proin tincidunt elit eleifend orci iaculis quis feugiat dui convallis.
1,482,482,NOW(),In non sapien non ex lobortis finibus.
1,483,483,NOW(),Duis fringilla turpis mollis eros ultricies vestibulum.
1,484,484,NOW(),Etiam molestie tellus sit amet sapien molestie dapibus.
1,485,485,NOW(),Praesent pellentesque tellus at libero hendrerit venenatis.
1,486,486,NOW(),Ut eget odio ac ex fringilla mollis a nec metus.
1,487,487,NOW(),Sed vel urna ut nisi congue laoreet.
1,488,488,NOW(),Pellentesque tempus arcu quis ex pretium vitae vulputate ex sagittis.
1,489,489,NOW(),Donec eleifend sem nec nulla iaculis molestie.
1,490,490,NOW(),Fusce eget risus quis tortor eleifend mollis.
1,491,491,NOW(),Maecenas in neque suscipit sodales ante id tincidunt justo.
1,492,492,NOW(),Vestibulum vel nunc vitae elit imperdiet ornare ut eu nulla.
1,493,493,NOW(),Morbi dignissim augue in risus tempor pulvinar.
1,494,494,NOW(),Sed facilisis neque sit amet nunc ullamcorper vitae gravida justo efficitur.
1,495,495,NOW(),Donec lacinia ex at tortor pharetra ullamcorper finibus sit amet nisi.
1,496,496,NOW(),Suspendisse convallis mi luctus dui facilisis quis maximus velit vestibulum.
1,497,497,NOW(),Fusce aliquet ipsum at ipsum dignissim dignissim.
1,498,498,NOW(),Vivamus gravida leo eu dolor tincidunt sed eleifend quam malesuada.
1,499,499,NOW(),Maecenas bibendum ipsum et tincidunt suscipit.
1,500,500,NOW(),Nam quis leo ornare commodo tortor sed semper ipsum.
1,501,501,NOW(),Maecenas a lacus et libero molestie elementum eu vitae ligula.
1,502,502,NOW(),Nunc dignissim leo quis diam gravida in porta orci convallis.
1,503,503,NOW(),Mauris nec leo vel nisi molestie tempus.
1,504,504,NOW(),Cras condimentum ex in lorem dignissim aliquam tincidunt elit ultricies.
1,505,505,NOW(),Integer ullamcorper velit sit amet enim egestas at pellentesque risus viverra.
1,506,506,NOW(),Morbi tempor odio condimentum semper convallis.
1,507,507,NOW(),Etiam tempus dolor sit amet purus aliquam vitae gravida eros eleifend.
1,508,508,NOW(),Maecenas rhoncus erat vitae hendrerit aliquam.
1,509,509,NOW(),Vivamus sit amet ante dictum sodales libero fringilla eleifend erat.
1,510,510,NOW(),Praesent nec ex venenatis egestas dui a luctus nunc.
1,511,511,NOW(),Vestibulum blandit nisi vel velit consequat rhoncus.
1,512,512,NOW(),Aenean tempor neque at venenatis fermentum.
1,513,513,NOW(),Morbi eu lorem quis tortor sodales rutrum.
1,514,514,NOW(),Praesent vehicula diam vel augue porttitor pharetra.
1,515,515,NOW(),Donec eu orci vitae dui facilisis malesuada.
1,516,516,NOW(),Duis tempus orci et ligula venenatis bibendum.
1,517,517,NOW(),Lorem ipsum dolor sit amet consectetur adipiscing elit.
1,518,518,NOW(),Nullam eu justo eget tortor iaculis aliquet.
1,519,519,NOW(),Nunc vel justo ut nibh tincidunt feugiat at bibendum lorem.
1,520,520,NOW(),Nunc egestas enim quis commodo rhoncus.
1,521,521,NOW(),Proin eget lectus at leo placerat venenatis id a magna.
1,522,522,NOW(),Proin quis nunc elementum convallis ligula a tristique neque.
1,523,523,NOW(),Vestibulum vel ex sed metus pulvinar malesuada.
1,524,524,NOW(),Maecenas ac diam a metus convallis rhoncus vel vitae orci.
1,525,525,NOW(),Suspendisse quis sapien tincidunt convallis risus vitae viverra lacus.
1,526,526,NOW(),Vivamus et quam mattis pellentesque diam non finibus mauris.
1,527,527,NOW(),Sed et risus non mi aliquam imperdiet nec facilisis metus.
1,528,528,NOW(),Quisque eu nunc sagittis maximus arcu at pellentesque massa.
1,529,529,NOW(),Nulla quis lorem in lectus interdum faucibus vel id nulla.
1,530,530,NOW(),Quisque pellentesque orci a enim convallis laoreet.
1,531,531,NOW(),Curabitur vulputate turpis et elit tempor et pharetra nunc porttitor.
1,532,532,NOW(),Cras tempor turpis sit amet lectus consectetur dignissim.
1,533,533,NOW(),Donec in neque nec felis gravida faucibus.
1,534,534,NOW(),Phasellus a arcu eu lectus malesuada faucibus.
1,535,535,NOW(),Quisque bibendum lorem a elit maximus tristique.
1,536,536,NOW(),Maecenas sed nulla finibus rhoncus libero quis porttitor velit.
1,537,537,NOW(),Nam venenatis odio in sem sodales sed maximus mauris ullamcorper.
1,538,538,NOW(),Nulla nec est sit amet neque tempus convallis.
1,539,539,NOW(),Praesent id dui vel leo bibendum malesuada ut vitae turpis.
1,540,540,NOW(),Nulla accumsan nisl et mauris tincidunt fringilla.
1,541,541,NOW(),In id libero rutrum facilisis erat sed suscipit urna.
1,542,542,NOW(),Ut non augue vitae ipsum sollicitudin iaculis.
1,543,543,NOW(),Mauris ut sapien mollis rhoncus diam vitae tristique turpis.
1,544,544,NOW(),Integer congue lorem vitae dui lacinia vitae feugiat nisl ullamcorper.
1,545,545,NOW(),Sed et orci vitae ex volutpat dictum.
1,546,546,NOW(),Nullam a mauris pharetra pretium urna eget accumsan massa.
1,547,547,NOW(),Sed pellentesque metus sed suscipit gravida.
1,548,548,NOW(),Sed ut massa eget neque aliquam hendrerit.
1,549,549,NOW(),Nullam aliquam lorem eget justo feugiat volutpat.
1,550,550,NOW(),Suspendisse eget velit porttitor dignissim ipsum quis rhoncus est.
1,551,551,NOW(),Maecenas pulvinar ante et lacus tincidunt nec imperdiet augue molestie.
1,552,552,NOW(),Aliquam sed ligula quis elit volutpat faucibus.
1,553,553,NOW(),Ut dictum leo ut gravida efficitur.
1,554,554,NOW(),Fusce at augue eget sem mollis sollicitudin.
1,555,555,NOW(),Sed eget mauris vel mi tincidunt tincidunt.
1,556,556,NOW(),Praesent eget lectus vel nulla sagittis lacinia non vitae justo.
1,557,557,NOW(),In ac massa et velit iaculis placerat.
1,558,558,NOW(),In tempor ipsum in diam lobortis luctus ultrices sem euismod.
1,559,559,NOW(),Donec ac metus in metus euismod sodales eu in turpis.
1,560,560,NOW(),Fusce eget est eget erat pellentesque dictum.
1,561,561,NOW(),Phasellus volutpat justo id lorem lobortis tempus.
1,562,562,NOW(),Mauris at nunc ut metus iaculis interdum eget vel leo.
1,563,563,NOW(),Aliquam at orci eu dui commodo maximus at ullamcorper massa.
1,564,564,NOW(),Aenean eget ligula posuere ullamcorper lorem in gravida massa.
1,565,565,NOW(),Nullam at nibh malesuada viverra ante at rutrum nibh.
1,566,566,NOW(),Pellentesque vel quam eu neque cursus gravida a ut dolor.
1,567,567,NOW(),Aenean tempus ligula et nulla lobortis interdum.
1,568,568,NOW(),Sed at tellus vitae erat interdum tempor.
1,569,569,NOW(),Nullam non diam eu ipsum porta viverra ut sit amet justo.
1,570,570,NOW(),Aenean dictum nibh ut rutrum mattis.
1,571,571,NOW(),Pellentesque nec ante dignissim quam tempor luctus eu nec urna.
1,572,572,NOW(),Nam suscipit velit eget sem tempor lobortis.
1,573,573,NOW(),Donec interdum magna consectetur mollis placerat.
1,574,574,NOW(),Vestibulum ut risus tempor semper metus vitae sodales massa.
1,575,575,NOW(),Donec et neque lobortis convallis diam in convallis ante.
1,576,576,NOW(),Phasellus sit amet lectus at nulla laoreet volutpat.
1,577,577,NOW(),Vivamus convallis sapien a justo pellentesque consectetur.
1,578,578,NOW(),Donec commodo quam vel posuere malesuada.
1,579,579,NOW(),Nunc quis tellus auctor tincidunt felis ac rutrum libero.
1,580,580,NOW(),Nullam ut quam eu leo pretium sodales.
1,581,581,NOW(),Aenean eget nulla interdum consectetur tortor at dictum ipsum.
1,582,582,NOW(),Pellentesque ut libero nec est consequat dignissim id eget ligula.
1,583,583,NOW(),Cras sit amet risus nec metus dictum lacinia eget sed arcu.
1,584,584,NOW(),Praesent sed lacus in tortor maximus ultricies a non eros.
1,585,585,NOW(),Nulla ut sem vitae lacus sodales aliquet ac sed purus.
1,586,586,NOW(),Praesent eu lorem id nisi sollicitudin dignissim non in neque.
1,587,587,NOW(),Nullam in sem efficitur condimentum risus sit amet rhoncus magna.
1,588,588,NOW(),Donec sed lectus eget sem blandit tincidunt a at ex.
1,589,589,NOW(),Sed tincidunt est nec est placerat id imperdiet orci elementum.
1,590,590,NOW(),Donec at lorem vestibulum auctor tellus faucibus mollis sem.
1,591,591,NOW(),Etiam tempor nisl eget ante volutpat porta.
1,592,592,NOW(),Proin in lectus vel justo ornare imperdiet non id est.
1,593,593,NOW(),Nunc vehicula lorem vitae nisl dictum sit amet consequat arcu faucibus.
1,594,594,NOW(),Etiam hendrerit velit vel ex suscipit in ullamcorper arcu blandit.
1,595,595,NOW(),Aenean sit amet nulla et risus hendrerit dapibus sed in ligula.
1,596,596,NOW(),Aliquam maximus odio imperdiet blandit blandit.
1,597,597,NOW(),In mollis leo eget dictum euismod.
1,598,598,NOW(),Phasellus accumsan nibh non eros semper ornare.
1,599,599,NOW(),Nulla non tellus sodales consequat erat nec commodo urna.
1,600,600,NOW(),Ut sagittis mauris sit amet odio laoreet accumsan.
1,601,601,NOW(),Nulla viverra felis sit amet rhoncus consequat.
1,602,602,NOW(),Aliquam condimentum arcu id urna gravida vitae mattis enim cursus.
1,603,603,NOW(),Pellentesque non arcu sit amet purus euismod ultrices id euismod lacus.
1,604,604,NOW(),Nunc pretium libero ac ipsum lacinia posuere.
1,605,605,NOW(),Sed id odio quis ex sagittis elementum vel sit amet risus.
1,606,606,NOW(),Nulla vel velit accumsan venenatis risus nec eleifend metus.
1,607,607,NOW(),Sed in tellus vel felis placerat faucibus.
1,608,608,NOW(),In ut enim id quam rhoncus ultrices quis a diam.
1,609,609,NOW(),Mauris a massa non mauris fermentum posuere at non nibh.
1,610,610,NOW(),Suspendisse non massa vitae dui rhoncus lacinia.
1,611,611,NOW(),Proin in magna vitae arcu ullamcorper scelerisque et at turpis.
1,612,612,NOW(),Duis efficitur tortor sit amet porta condimentum.
1,613,613,NOW(),Ut mattis est sed magna tristique non viverra lorem rutrum.
1,614,614,NOW(),Ut egestas turpis ut magna pharetra consequat.
1,615,615,NOW(),Sed ut turpis sagittis egestas ex et hendrerit lacus.
1,616,616,NOW(),Nunc faucibus arcu nec vestibulum varius.
1,617,617,NOW(),Mauris maximus dui dignissim erat blandit laoreet.
1,618,618,NOW(),Nulla in eros at odio posuere fringilla.
1,619,619,NOW(),Fusce sed mi sit amet erat sodales egestas nec eu ante.
1,620,620,NOW(),Quisque vitae orci bibendum sodales nisi a aliquet nisl.
1,621,621,NOW(),Morbi vel lectus tincidunt dapibus felis id vehicula sem.
1,622,622,NOW(),Integer rhoncus felis vitae nunc faucibus placerat.
1,623,623,NOW(),Donec pellentesque tellus cursus dignissim nibh at ultrices diam.
1,624,624,NOW(),Fusce non sem vel libero ultrices lacinia.
1,625,625,NOW(),Sed ultrices risus ac arcu lobortis at vestibulum velit accumsan.
1,626,626,NOW(),Vivamus hendrerit enim ut diam imperdiet pulvinar pellentesque nunc sollicitudin.
1,627,627,NOW(),Quisque ut odio at ex imperdiet accumsan et sed magna.
1,628,628,NOW(),In at orci et nisl dapibus scelerisque nec et justo.
1,629,629,NOW(),Duis viverra lacus non posuere tristique.
1,630,630,NOW(),Proin ac velit aliquam gravida quam a laoreet nibh.
1,631,631,NOW(),Donec quis nisl facilisis posuere velit in mattis purus.
1,632,632,NOW(),Phasellus vel nisl iaculis erat interdum placerat at consequat est.
1,633,633,NOW(),Pellentesque ut enim faucibus blandit dolor rhoncus maximus diam.
1,634,634,NOW(),Donec ac est at turpis tincidunt varius posuere ut leo.
1,635,635,NOW(),Morbi semper neque et justo cursus consequat.
1,636,636,NOW(),Nulla sed nisl eu ligula tincidunt bibendum a vitae neque.
1,637,637,NOW(),Nunc finibus nisl a finibus porta.
1,638,638,NOW(),Pellentesque eleifend sapien sit amet mauris pharetra ultrices.
1,639,639,NOW(),Vestibulum vel erat a lacus auctor elementum non ac enim.
1,640,640,NOW(),Nunc vitae dolor tempor facilisis odio vel varius lorem.
1,641,641,NOW(),Etiam a quam ultrices mi scelerisque feugiat vitae eget metus.
1,642,642,NOW(),Sed vitae arcu in lectus sodales tincidunt.
1,643,643,NOW(),Curabitur molestie ex sit amet libero lacinia placerat.
1,644,644,NOW(),Sed nec libero ac lectus molestie consectetur sed ut felis.
1,645,645,NOW(),Integer non mauris euismod tristique urna ac varius enim.
1,646,646,NOW(),Nunc egestas elit eu posuere aliquet.
1,647,647,NOW(),Fusce congue dolor sit amet tortor bibendum eleifend.
1,648,648,NOW(),Quisque tristique dui et sodales sagittis.
1,649,649,NOW(),Phasellus ullamcorper tellus a purus aliquam ultrices.
1,650,650,NOW(),Mauris malesuada sem eu sodales bibendum.
1,651,651,NOW(),Donec rutrum nisl id purus hendrerit a cursus nisl ultricies.
1,652,652,NOW(),Nunc ut odio ac sapien gravida condimentum ut nec ante.
1,653,653,NOW(),Morbi nec urna nec lectus elementum aliquet in finibus lorem.
1,654,654,NOW(),Nulla accumsan purus sit amet gravida porta.
1,655,655,NOW(),Duis accumsan est eu turpis tristique et vestibulum justo tristique.
1,656,656,NOW(),Maecenas sodales libero eget neque semper et pharetra leo pulvinar.
1,657,657,NOW(),Sed luctus nibh in quam tincidunt non dignissim urna posuere.
1,658,658,NOW(),In eget lacus rhoncus convallis ex id tristique justo.
1,659,659,NOW(),Donec viverra erat eget magna tempus non posuere ipsum laoreet.
1,660,660,NOW(),Vivamus imperdiet arcu id turpis ullamcorper hendrerit.
1,661,661,NOW(),Donec dignissim risus eget justo posuere non ornare nunc eleifend.
1,662,662,NOW(),Aliquam vel orci viverra facilisis leo eget convallis orci.
1,663,663,NOW(),Sed interdum purus ac turpis auctor pulvinar.
1,664,664,NOW(),Curabitur ut quam accumsan fringilla diam a porta tortor.
1,665,665,NOW(),Integer eleifend augue sed sapien tempus ullamcorper aliquam nec odio.
1,666,666,NOW(),Integer mattis metus quis dapibus ultrices.
1,667,667,NOW(),Vestibulum eget mauris scelerisque molestie sapien nec fringilla est.
1,668,668,NOW(),Vivamus lacinia nunc sit amet nisl tristique nec mattis leo egestas.
1,669,669,NOW(),Nunc vestibulum erat in porta malesuada.
1,670,670,NOW(),Pellentesque at risus a urna interdum dapibus aliquam in urna.
1,671,671,NOW(),Sed sed nibh nec mi tempor iaculis.
1,672,672,NOW(),Integer id lorem fermentum lacus feugiat iaculis quis ullamcorper sapien.
1,673,673,NOW(),Morbi id ipsum nec metus facilisis volutpat sed at lectus.
1,674,674,NOW(),Morbi congue ante sed enim semper eget commodo metus luctus.
1,675,675,NOW(),Aliquam et nulla in dolor molestie mollis.
1,676,676,NOW(),Sed ut lectus convallis semper nisi at volutpat massa.
1,677,677,NOW(),Nulla sodales neque at lorem consectetur ut posuere nisl dignissim.
1,678,678,NOW(),Mauris vel massa vel tellus blandit semper.
1,679,679,NOW(),Maecenas et ante eu mauris porta vestibulum vel ac mi.
1,680,680,NOW(),Pellentesque non orci ut orci ornare pulvinar nec in ex.
1,681,681,NOW(),Pellentesque commodo arcu vel rutrum tristique.
1,682,682,NOW(),Curabitur at est blandit bibendum arcu in dapibus dui.
1,683,683,NOW(),Aliquam sit amet dui blandit pulvinar magna dictum laoreet sem.
1,684,684,NOW(),Aenean faucibus risus at nisl ornare ac ornare augue tincidunt.
1,685,685,NOW(),Mauris eget nunc vitae nunc auctor dictum ac scelerisque quam.
1,686,686,NOW(),Ut non dolor auctor molestie turpis eget hendrerit magna.
1,687,687,NOW(),In vel neque et lectus porttitor accumsan.
1,688,688,NOW(),Donec quis nisi eu nisi fringilla gravida sed in dolor.
1,689,689,NOW(),Proin at tellus blandit mollis leo eu tempus erat.
1,690,690,NOW(),Phasellus vulputate nibh et vulputate semper.
1,691,691,NOW(),Phasellus non tellus id orci vulputate cursus sit amet a tellus.
1,692,692,NOW(),Integer iaculis tellus sit amet risus eleifend sagittis.
1,693,693,NOW(),Sed vestibulum ex at felis tempus ac bibendum urna placerat.
1,694,694,NOW(),Nulla id nulla venenatis ex rhoncus consequat.
1,695,695,NOW(),Phasellus nec diam cursus lobortis ipsum at consectetur erat.
1,696,696,NOW(),Mauris scelerisque lacus rutrum placerat dapibus.
1,697,697,NOW(),Suspendisse tempus lectus ut nisl tempus nec varius augue ornare.
1,698,698,NOW(),Ut volutpat lorem a justo dignissim quis ultricies ante aliquet.
1,699,699,NOW(),Sed id magna a tortor posuere rutrum vitae sit amet neque.
1,700,700,NOW(),Maecenas a orci quis dolor rutrum dapibus.
1,701,701,NOW(),Aenean eget magna aliquam tellus dapibus accumsan sed quis ligula.
1,702,702,NOW(),Ut vitae turpis fermentum efficitur tellus et hendrerit lacus.
1,703,703,NOW(),Donec tincidunt eros quis ipsum scelerisque nec lobortis urna cursus.
1,704,704,NOW(),Maecenas in diam eu massa congue eleifend eleifend ut lectus.
1,705,705,NOW(),Phasellus id risus nec enim interdum porttitor.
1,706,706,NOW(),In laoreet nunc vel ligula viverra et mattis ex commodo.
1,707,707,NOW(),Quisque et dui eu elit rutrum rutrum ullamcorper dictum neque.
1,708,708,NOW(),Cras sed ligula id augue auctor efficitur at id lectus.
1,709,709,NOW(),Aenean ut velit auctor porttitor ligula a dictum mauris.
1,710,710,NOW(),Maecenas eget enim a leo ultricies posuere.
1,711,711,NOW(),Praesent et tortor viverra nibh bibendum varius.
1,712,712,NOW(),Integer fermentum arcu nec ipsum luctus tincidunt.
1,713,713,NOW(),Morbi eu mauris tempor elementum metus non volutpat sapien.
1,714,714,NOW(),Nulla in libero consequat hendrerit quam ac ultrices odio.
1,715,715,NOW(),Cras eget lectus et elit bibendum volutpat.
1,716,716,NOW(),Suspendisse ac ipsum pulvinar tempus augue eget pellentesque nunc.
1,717,717,NOW(),Nunc eget odio pellentesque lobortis odio a tincidunt nulla.
1,718,718,NOW(),Mauris eu sapien cursus ullamcorper eros id accumsan lacus.
1,719,719,NOW(),Aenean ac orci ullamcorper tristique quam a maximus diam.
1,720,720,NOW(),Etiam lacinia risus sit amet aliquam tincidunt.
1,721,721,NOW(),Donec ut erat at ex pulvinar condimentum.
1,722,722,NOW(),In pretium mi et ex vulputate ultricies.
