2,324,445,NOW(),Vestibulum tincidunt ligula dapibus urna tincidunt vel pretium dolor commodo.
2,325,446,NOW(),Vivamus tincidunt velit nec diam aliquam a eleifend odio ullamcorper.
2,326,447,NOW(),Ut luctus erat vel ipsum pulvinar rhoncus.
2,327,448,NOW(),Quisque vel tortor quis leo tempor malesuada.
2,328,449,NOW(),Morbi malesuada tortor quis sem commodo rutrum.
2,329,450,NOW(),Sed fermentum ligula ac nisi molestie interdum.
2,330,451,NOW(),Donec porta diam vel sapien scelerisque sit amet ornare erat ultricies.
2,331,452,NOW(),Donec posuere arcu eu tristique ullamcorper.
2,332,453,NOW(),Nam porta justo id lectus dapibus viverra.
2,333,454,NOW(),Aenean quis elit et purus tempor molestie id sit amet nisl.
2,334,455,NOW(),Quisque ac nunc rutrum egestas dui ac convallis ex.
2,335,456,NOW(),In iaculis lorem sit amet quam efficitur pretium.
2,336,457,NOW(),Proin at orci nec justo maximus volutpat pretium quis risus.
2,337,458,NOW(),Donec hendrerit velit vel libero accumsan eu pharetra nunc feugiat.
2,338,459,NOW(),Curabitur ultricies sapien vel neque imperdiet mattis.
2,339,460,NOW(),Phasellus fermentum mauris a ipsum porttitor et tincidunt nulla pellentesque.
2,340,461,NOW(),Nullam sed lectus sed enim porta malesuada.
2,341,462,NOW(),Duis in tortor id massa bibendum bibendum.
2,342,463,NOW(),Nunc dapibus lectus vitae magna consectetur semper ac eget orci.
2,343,464,NOW(),Mauris egestas nisl eget eros fringilla vel varius mauris sodales.
2,344,465,NOW(),Nam vel leo ut erat aliquet dapibus.
2,345,466,NOW(),Nullam congue erat non turpis blandit vitae efficitur ante ornare.
2,346,467,NOW(),Nulla in nibh eleifend tincidunt odio eget ultricies est.
2,347,468,NOW(),Nulla eu justo feugiat accumsan nibh eu luctus dolor.
2,348,469,NOW(),Phasellus ac dui venenatis consectetur nibh porta ullamcorper arcu.
2,349,470,NOW(),Ut sed nisi hendrerit mattis arcu hendrerit congue lorem.
2,350,471,NOW(),Suspendisse sit amet est efficitur cursus felis mollis porttitor magna.
2,351,472,NOW(),Duis posuere enim vitae nulla congue a eleifend libero ullamcorper.
2,352,473,NOW(),Maecenas pulvinar dolor sollicitudin dui iaculis imperdiet.
2,353,474,NOW(),Curabitur sed lorem a diam vehicula tempus.
2,354,475,NOW(),Integer at dolor blandit vehicula mauris in luctus metus.
2,355,476,NOW(),Praesent in ligula non dui egestas posuere.
2,356,477,NOW(),Vestibulum hendrerit ipsum imperdiet cursus ornare.
2,357,478,NOW(),Sed vestibulum nisl sit amet egestas efficitur.
2,358,479,NOW(),Nullam et sem non nibh commodo consectetur.
2,359,480,NOW(),Sed non lorem eget lectus laoreet convallis sed nec erat.
2,360,481,NOW(),Curabitur at mi molestie dictum libero quis malesuada tortor.
2,361,482,NOW(),Nam feugiat est in arcu sollicitudin id pellentesque nulla vehicula.
2,362,483,NOW(),Suspendisse quis metus non massa tempus dignissim.
2,363,484,NOW(),Fusce porttitor enim in egestas pulvinar.
2,364,485,NOW(),Praesent a lorem nec dui efficitur euismod.
2,365,486,NOW(),Suspendisse id ipsum semper aliquet lacus sit amet viverra ante.
2,366,487,NOW(),Etiam accumsan purus ut libero pellentesque sagittis.
2,367,488,NOW(),Proin congue nulla nec sapien consectetur non suscipit odio viverra.
2,368,489,NOW(),Aenean vehicula orci nec convallis pharetra.
2,369,490,NOW(),Mauris elementum tellus a facilisis dapibus.
2,370,491,NOW(),Nam rhoncus massa sed risus mattis viverra.
2,371,492,NOW(),Vivamus tempus velit non eros suscipit eget dignissim neque fermentum.
2,372,493,NOW(),Mauris id nulla gravida interdum libero eu varius leo.
2,373,494,NOW(),Quisque vitae massa lacinia posuere tellus euismod dapibus dolor.
2,374,495,NOW(),Vivamus viverra purus ornare feugiat ligula nec interdum ante.
2,375,496,NOW(),Ut at enim eget ante elementum vehicula.
2,376,497,NOW(),Duis non lacus et odio auctor consectetur eu in sem.
2,377,498,NOW(),Suspendisse cursus turpis quis luctus cursus.
2,378,499,NOW(),Sed congue nisl vitae efficitur sodales.
2,379,500,NOW(),Mauris vitae mi iaculis pharetra tortor non commodo est.
2,380,501,NOW(),Sed ac odio congue faucibus nulla id lacinia lectus.
2,381,502,NOW(),Nam tincidunt velit ac libero pulvinar ultrices.
2,382,503,NOW(),Cras gravida metus ac ipsum rutrum fringilla.
2,383,504,NOW(),Praesent at magna blandit convallis dolor ut bibendum arcu.
2,384,505,NOW(),Morbi porta dui sit amet lorem posuere at fermentum nulla scelerisque.
2,385,506,NOW(),Aenean et erat auctor ornare nulla id tristique eros.
2,386,507,NOW(),Sed feugiat mauris et egestas dictum.
2,387,508,NOW(),Morbi vulputate risus ullamcorper rhoncus rhoncus.
2,388,509,NOW(),Vestibulum lobortis felis eget arcu tincidunt sit amet finibus neque aliquam.
2,389,510,NOW(),Nam sed tortor blandit hendrerit dolor et pharetra elit.
2,390,511,NOW(),Sed quis lacus quis odio suscipit consequat sagittis at odio.
2,391,512,NOW(),Donec porta neque in elit tincidunt consequat.
2,392,513,NOW(),Sed et nunc id velit vulputate suscipit ut quis urna.
2,393,514,NOW(),Integer ultricies diam id leo lobortis commodo ut a felis.
2,394,515,NOW(),Sed sed justo ac augue malesuada mattis at non dui.
2,395,516,NOW(),Sed at justo a sem posuere dapibus eget eget nibh.
2,396,517,NOW(),Fusce sed justo vel libero tristique placerat et sed ipsum.
2,397,518,NOW(),Ut porta metus id lacus rutrum pretium.
2,398,519,NOW(),Sed in magna sed nulla luctus faucibus eu ut lorem.
2,399,520,NOW(),Nam iaculis justo quis iaculis venenatis.
2,400,521,NOW(),Nam vulputate mauris a tortor hendrerit ac congue enim interdum.
2,401,522,NOW(),Mauris at est feugiat hendrerit dolor sed tempus enim.
2,402,523,NOW(),Praesent a lacus sed ipsum porttitor dictum id sed nisi.
2,403,524,NOW(),Duis semper nisi vel ante fermentum at eleifend dolor ullamcorper.
2,404,525,NOW(),Duis a nulla eu felis consequat interdum.
2,405,526,NOW(),Pellentesque sed mi dapibus sagittis tortor ut imperdiet massa.
2,406,527,NOW(),Integer dictum nunc non massa consequat et mattis mi maximus.
2,407,528,NOW(),In pretium massa quis turpis tempus aliquam.
2,408,529,NOW(),Donec rutrum turpis sed mi commodo at tristique mauris molestie.
2,409,530,NOW(),Nullam sit amet risus in diam tristique mattis.
2,410,531,NOW(),Donec fringilla velit vel ipsum convallis laoreet efficitur lacus scelerisque.
2,411,532,NOW(),Duis at purus semper egestas ligula sed posuere lacus.
2,412,533,NOW(),Maecenas quis quam et libero lacinia interdum eget sed erat.
2,413,534,NOW(),Mauris non ligula et purus tempor commodo id eget ex.
2,414,535,NOW(),Morbi nec turpis eu ex auctor rutrum vitae a purus.
2,415,536,NOW(),Nullam id erat in augue cursus molestie non vel risus.
2,416,537,NOW(),Cras convallis leo quis egestas venenatis.
2,417,538,NOW(),Nunc nec eros porttitor fermentum elit semper convallis dolor.
2,418,539,NOW(),Fusce mollis nisi non nisi dapibus placerat.
2,419,540,NOW(),Nulla laoreet eros nec placerat maximus.
2,420,541,NOW(),Vivamus id leo non enim consequat semper id vitae arcu.
2,421,542,NOW(),Nam interdum justo vitae rutrum posuere.
2,422,543,NOW(),Vestibulum at nisl ac tellus porta mattis non at est.
2,423,544,NOW(),Donec bibendum turpis id augue faucibus quis pulvinar enim aliquam.
2,424,545,NOW(),Duis et erat a turpis luctus malesuada at at nisl.
2,425,546,NOW(),Mauris maximus nulla vitae mauris cursus malesuada.
2,426,547,NOW(),Duis condimentum neque nec accumsan facilisis.
2,427,548,NOW(),Praesent gravida magna vel vehicula condimentum.
2,428,549,NOW(),Ut ut lorem lacinia fermentum metus sit amet vestibulum quam.
2,429,550,NOW(),Sed non lectus sollicitudin cursus orci sed condimentum lacus.
2,430,551,NOW(),Duis vulputate ex in magna placerat quis aliquam lacus egestas.
2,431,552,NOW(),Ut vestibulum neque fermentum aliquet ultricies.
2,432,553,NOW(),Aenean id magna vel quam ornare imperdiet.
2,433,554,NOW(),Aliquam cursus purus vel massa accumsan ultricies.
2,434,555,NOW(),Cras cursus lectus ut pellentesque luctus.
2,435,556,NOW(),Sed luctus ante nec dolor scelerisque et sagittis sem maximus.
2,436,557,NOW(),Nullam ornare erat at velit tristique consectetur suscipit risus pellentesque.
2,437,558,NOW(),Integer eu neque interdum molestie enim quis malesuada augue.
2,438,559,NOW(),Suspendisse vulputate urna non dignissim semper.
2,439,560,NOW(),Duis vitae erat ut dolor cursus interdum consectetur nec quam.
2,440,561,NOW(),Lorem ipsum dolor sit amet consectetur adipiscing elit.
2,441,562,NOW(),Vivamus vitae sem sit amet mauris fringilla aliquet vel nec metus.
2,442,563,NOW(),Maecenas aliquam tellus et congue congue.
2,443,564,NOW(),Curabitur non mi et velit sodales egestas.
2,444,565,NOW(),Nulla quis nunc sit amet magna ultricies facilisis.
2,445,566,NOW(),Cras vitae orci id sapien fermentum semper.
2,446,567,NOW(),Pellentesque vulputate nisl a nulla molestie eget faucibus ipsum vestibulum.
2,447,568,NOW(),Ut iaculis metus ac porttitor lobortis.
2,448,569,NOW(),Nullam vitae quam vitae velit facilisis accumsan.
2,449,570,NOW(),Cras iaculis ante non consectetur fermentum.
2,450,571,NOW(),Phasellus nec purus eget lectus porttitor tincidunt id in risus.
2,451,572,NOW(),Donec ac sapien eu nunc iaculis porta.
2,452,573,NOW(),Proin nec felis varius sagittis lorem vel feugiat leo.
2,453,574,NOW(),Donec placerat justo placerat ipsum egestas nec facilisis augue faucibus.
2,454,575,NOW(),Praesent vitae metus et eros imperdiet interdum ac vel lectus.
2,455,576,NOW(),Vestibulum eu dolor hendrerit sapien ullamcorper maximus.
2,456,577,NOW(),Suspendisse laoreet elit at risus convallis et ultricies tellus facilisis.
2,457,578,NOW(),Donec nec sem ornare interdum augue at consequat libero.
2,458,579,NOW(),Sed aliquam orci at sagittis vestibulum.
2,459,580,NOW(),Phasellus elementum mi vel nunc posuere non gravida felis dignissim.
2,460,581,NOW(),Aenean sed leo ac nunc ultricies euismod sagittis at tellus.
2,461,582,NOW(),Etiam vehicula est quis lorem lacinia vel mattis felis consequat.
2,462,583,NOW(),Nulla vehicula velit eget porta vulputate.
2,463,584,NOW(),Aenean rhoncus nisi sit amet metus imperdiet non efficitur ex commodo.
2,464,585,NOW(),Nam non nibh imperdiet arcu tempus bibendum.
2,465,586,NOW(),Phasellus fringilla felis ut nunc lacinia ornare.
2,466,587,NOW(),Sed finibus massa non elit tincidunt sagittis.
2,467,588,NOW(),Curabitur in magna semper sagittis lectus sed blandit lorem.
2,468,589,NOW(),Morbi facilisis arcu vitae ultrices convallis.
2,469,590,NOW(),Phasellus id nibh vestibulum mauris tempus feugiat a eget justo.
2,470,591,NOW(),Vivamus et nisi luctus eleifend nibh sit amet imperdiet nisl.
2,471,592,NOW(),Sed facilisis dolor eu quam gravida quis ultricies erat lacinia.
2,472,593,NOW(),Integer et felis a enim convallis semper.
2,473,594,NOW(),Nullam sed urna efficitur tincidunt arcu sodales tincidunt libero.
2,474,595,NOW(),Nullam sed est posuere hendrerit quam et efficitur sem.
2,475,596,NOW(),Suspendisse lobortis dui quis tempor tristique.
2,476,597,NOW(),Morbi sed arcu euismod ultrices dui vitae viverra libero.
2,477,598,NOW(),Donec feugiat elit molestie ullamcorper purus bibendum placerat purus.
2,478,599,NOW(),Nunc mattis libero id mauris fringilla sit amet bibendum lacus gravida.
2,479,600,NOW(),Aenean vitae nunc quis erat gravida ullamcorper.
2,480,601,NOW(),Vestibulum quis orci sit amet arcu tincidunt viverra eu eu dolor.
2,481,602,NOW(),Morbi sodales est quis augue rutrum lacinia.
2,482,603,NOW(),Maecenas elementum est ut nunc venenatis ultrices.
2,483,604,NOW(),Ut pharetra nulla varius arcu volutpat elementum.
2,484,605,NOW(),Mauris fermentum mauris et lorem consectetur sit amet tincidunt urna sagittis.
2,485,606,NOW(),Cras malesuada nulla non lacinia interdum.
2,486,607,NOW(),Fusce hendrerit nisl vitae vulputate lacinia.
2,487,608,NOW(),Morbi commodo ipsum at vulputate imperdiet.
2,488,609,NOW(),Maecenas id mauris aliquam vestibulum nisi nec fermentum libero.
2,489,610,NOW(),Sed auctor lectus quis aliquet rhoncus.
2,490,611,NOW(),Fusce blandit metus sit amet est semper nec tincidunt sem volutpat.
2,491,612,NOW(),Sed a mauris at urna placerat congue ullamcorper quis libero.
2,492,613,NOW(),Cras nec dui bibendum venenatis libero eu ultricies lectus.
2,493,614,NOW(),Praesent at eros eleifend aliquam sapien et vestibulum dolor.
2,494,615,NOW(),Maecenas viverra magna sed interdum mollis.
2,495,616,NOW(),Sed id ipsum at risus sagittis commodo id eleifend nisl.
2,496,617,NOW(),Donec interdum elit lobortis purus eleifend in rutrum lectus convallis.
2,497,618,NOW(),Donec pellentesque nunc feugiat luctus eros ut ultrices quam.
2,498,619,NOW(),Sed posuere erat quis aliquam bibendum.
2,499,620,NOW(),Donec in elit quis justo consectetur rhoncus.
2,500,621,NOW(),Donec in lacus et velit egestas consequat aliquet id ipsum.
2,501,622,NOW(),Integer a erat eu ipsum faucibus auctor.
2,502,623,NOW(),Curabitur eget turpis at turpis posuere tincidunt in sed orci.
2,503,624,NOW(),Proin at turpis semper convallis mi vel efficitur orci.
2,504,625,NOW(),Quisque eget urna mattis est ornare sagittis.
2,505,626,NOW(),Maecenas vulputate quam ac arcu consectetur gravida et nec sem.
2,506,627,NOW(),Cras at turpis vel arcu dapibus luctus nec quis mi.
2,507,628,NOW(),Ut dignissim massa eu tortor condimentum in porta nisl porta.
2,508,629,NOW(),Cras tincidunt ipsum at ex fermentum pulvinar.
2,509,630,NOW(),Curabitur ac urna finibus tristique dui eget posuere ipsum.
2,510,631,NOW(),Donec nec nunc aliquet laoreet sapien ut commodo ipsum.
2,511,632,NOW(),Cras eu mi sed enim porta fringilla.
2,512,633,NOW(),Nullam rutrum odio sed bibendum convallis.
2,513,634,NOW(),Phasellus a purus dictum sem euismod facilisis in sed leo.
2,514,635,NOW(),Cras ut nulla nec nibh sagittis vulputate.
2,515,636,NOW(),Aliquam posuere velit non est maximus tincidunt.
2,516,637,NOW(),Donec ullamcorper ex non lorem scelerisque ut efficitur turpis facilisis.
2,517,638,NOW(),Fusce vel neque non odio ultricies vehicula at at urna.
2,518,639,NOW(),Suspendisse efficitur sapien ac nisl bibendum facilisis.
2,519,640,NOW(),Curabitur semper nisl at leo vehicula vulputate.
2,520,641,NOW(),Sed sit amet ante nec orci congue dapibus.
2,521,642,NOW(),Quisque nec nulla id felis placerat malesuada ac a felis.
2,522,643,NOW(),Nulla elementum risus in faucibus efficitur.
2,523,644,NOW(),Fusce id est molestie ornare libero ac posuere mauris.
2,524,645,NOW(),Suspendisse vehicula risus quis justo rhoncus mattis.
2,525,646,NOW(),Duis iaculis metus quis elementum finibus.
2,526,647,NOW(),Curabitur facilisis nibh ut ultricies eleifend.
2,527,648,NOW(),Etiam tempor risus vel massa eleifend eleifend.
2,528,649,NOW(),Ut tempor augue eu est dapibus euismod sit amet a dolor.
2,529,650,NOW(),Ut malesuada risus at magna finibus sodales sodales tortor elementum.
2,530,651,NOW(),Proin ultrices sapien nec congue pretium.
2,531,652,NOW(),Aenean feugiat purus vitae bibendum mollis.
2,532,653,NOW(),Etiam sit amet ligula aliquam interdum nulla non pellentesque felis.
2,533,654,NOW(),Donec ultrices tortor nec ex accumsan dignissim.
2,534,655,NOW(),Vivamus dapibus diam id dolor tincidunt nec tincidunt velit ultricies.
2,535,656,NOW(),Donec id erat hendrerit semper augue sit amet ultrices sem.
2,536,657,NOW(),Curabitur vel tellus ut dolor feugiat convallis.
2,537,658,NOW(),Maecenas at ex eget neque efficitur porttitor id ac justo.
2,538,659,NOW(),Ut fringilla odio sed porta sagittis.
2,539,660,NOW(),Mauris dignissim mi vel mauris ultricies euismod.
2,540,661,NOW(),Duis nec sapien quis neque suscipit congue.
2,541,662,NOW(),Integer consequat lorem eu sapien aliquam interdum eget in massa.
2,542,663,NOW(),Nunc luctus enim eget tortor auctor varius.
2,543,664,NOW(),Sed et mauris rutrum dapibus lectus eu varius eros.
2,544,665,NOW(),Morbi lobortis massa vel massa aliquet eu tincidunt arcu vehicula.
2,545,666,NOW(),Nunc eleifend purus a posuere volutpat.
2,546,667,NOW(),Proin quis mauris vulputate consequat sem vel vehicula odio.
2,547,668,NOW(),Ut nec ipsum fringilla posuere diam sit amet rhoncus neque.
2,548,669,NOW(),Ut vel ipsum in elit lobortis iaculis.
2,549,670,NOW(),Morbi congue metus vel felis fermentum malesuada.
2,550,671,NOW(),Aliquam faucibus mi interdum massa scelerisque cursus.
2,551,672,NOW(),Nam cursus lectus sit amet neque faucibus id elementum sem elementum.
2,552,673,NOW(),Cras vitae felis eget nunc ullamcorper varius.
2,553,674,NOW(),Nulla auctor odio vestibulum ante posuere eu ullamcorper velit vulputate.
2,554,675,NOW(),Phasellus dictum justo quis mauris maximus eleifend.
2,555,676,NOW(),Curabitur feugiat purus sit amet leo iaculis dapibus.
2,556,677,NOW(),Etiam sed diam et diam commodo volutpat.
2,557,678,NOW(),Integer venenatis enim quis ultricies egestas.
2,558,679,NOW(),Aenean vitae metus suscipit mollis augue at commodo turpis.
2,559,680,NOW(),Nunc efficitur risus nec ornare condimentum.
2,560,681,NOW(),Nullam sit amet eros vel odio faucibus tempus.
2,561,682,NOW(),Morbi dictum metus id massa venenatis eu elementum est ullamcorper.
2,562,683,NOW(),Duis tincidunt turpis eget nisi dapibus mollis.
2,563,684,NOW(),Vivamus placerat mi at vulputate malesuada.
2,564,685,NOW(),Praesent pharetra justo vitae molestie ultricies.
2,565,686,NOW(),Pellentesque varius augue ac erat viverra vestibulum.
2,566,687,NOW(),Donec aliquam leo sit amet metus feugiat volutpat.
2,567,688,NOW(),Vestibulum iaculis lorem gravida purus laoreet pharetra.
2,568,689,NOW(),Donec id orci ornare eleifend nunc a gravida ex.
2,569,690,NOW(),Praesent ultricies orci nec erat tempor ac sodales neque aliquet.
2,570,691,NOW(),Proin faucibus erat eget turpis vehicula tincidunt.
2,571,692,NOW(),Nullam et mauris vitae ipsum tempor luctus.
2,572,693,NOW(),Nullam imperdiet elit nec aliquam sodales.
2,573,694,NOW(),Aenean fermentum tellus sit amet nisl pulvinar at vehicula massa tincidunt.
2,574,695,NOW(),Curabitur sit amet ex ac libero ullamcorper dapibus id id ex.
2,575,696,NOW(),Aliquam quis arcu sagittis congue mi eu consequat tortor.
2,576,697,NOW(),Maecenas rutrum massa eu lobortis imperdiet.
2,577,698,NOW(),Integer faucibus enim sed ipsum gravida dictum.
2,578,699,NOW(),Morbi ultricies dui tempor dolor mattis sed suscipit risus ultricies.
2,579,700,NOW(),Mauris efficitur quam sed dapibus egestas.
2,580,701,NOW(),Nam quis dolor ac diam hendrerit congue viverra et elit.
2,581,702,NOW(),Quisque mattis turpis ut volutpat imperdiet.
2,582,703,NOW(),Phasellus hendrerit odio nec convallis rutrum.
2,583,704,NOW(),Mauris luctus nisl et ex imperdiet iaculis.
2,584,705,NOW(),Aenean ornare libero non laoreet sagittis.
2,585,706,NOW(),In congue libero nec magna feugiat et dignissim mauris auctor.
2,586,707,NOW(),Duis vitae nunc in mi sagittis vehicula et sit amet erat.
2,587,708,NOW(),Donec fringilla turpis sit amet ultrices dictum.
2,588,709,NOW(),Nunc consectetur neque eu dictum porta.
2,589,710,NOW(),Aenean suscipit ligula finibus ante consectetur porttitor.
2,590,711,NOW(),Duis aliquet sapien eget justo efficitur ut faucibus ligula lacinia.
2,591,712,NOW(),Mauris eget sapien bibendum odio molestie sodales in in lectus.
2,592,713,NOW(),Integer posuere dui quis euismod tincidunt.
2,593,714,NOW(),Quisque mollis lectus nec ipsum suscipit auctor.
2,594,715,NOW(),Aenean tempor est in lacus semper mattis.
2,595,716,NOW(),Morbi nec sapien consequat elementum felis sed porta massa.
2,596,717,NOW(),Donec sit amet erat id magna porttitor finibus.
2,597,718,NOW(),Nulla ac sem semper venenatis dui non maximus mauris.
2,598,719,NOW(),Integer suscipit felis a enim accumsan sed lobortis lacus ultricies.
2,599,720,NOW(),Etiam eu lorem feugiat molestie eros in sagittis justo.
2,600,721,NOW(),Donec mattis lectus eget arcu placerat sed efficitur massa ornare.
2,601,722,NOW(),In id lorem in leo mattis iaculis et vitae ex.
2,602,723,NOW(),Sed maximus tortor bibendum diam venenatis rutrum.
2,603,724,NOW(),Fusce pellentesque ex eu accumsan placerat.
2,604,725,NOW(),Nunc dapibus diam sed hendrerit finibus.
2,605,726,NOW(),Proin lobortis eros a ex ultricies ullamcorper.
2,606,727,NOW(),In pretium tellus sit amet rhoncus porta.
2,607,728,NOW(),Donec nec dolor feugiat luctus nibh sed bibendum quam.
2,608,729,NOW(),Cras eu lorem eu sem fringilla finibus at tempus nulla.
2,609,730,NOW(),Sed eget nisl nec lectus ornare aliquet at non tortor.
2,610,731,NOW(),Proin nec leo efficitur congue nisl a sodales ex.
2,611,732,NOW(),Nulla nec purus eget orci cursus eleifend.
2,612,733,NOW(),Sed efficitur urna vitae justo semper id iaculis libero lobortis.
2,613,734,NOW(),Nullam in nulla ut neque ultrices viverra.
2,614,735,NOW(),Mauris a enim accumsan mauris pulvinar maximus volutpat porttitor felis.
2,615,736,NOW(),Maecenas lobortis velit at convallis tempus.
2,616,737,NOW(),Donec mattis elit nec elementum blandit.
2,617,738,NOW(),Aenean vel dui a elit viverra fermentum faucibus vitae diam.
2,618,739,NOW(),Vivamus vehicula erat vel egestas tempus.
2,619,740,NOW(),Nam vitae tortor sit amet ipsum mattis consequat.
2,620,741,NOW(),Quisque fermentum odio sollicitudin ipsum tincidunt ut vehicula erat congue.
2,621,742,NOW(),Donec eu risus in mi venenatis pulvinar.
2,622,743,NOW(),Morbi nec lectus congue accumsan justo et elementum augue.
2,623,744,NOW(),Proin sodales nunc lobortis odio ultricies hendrerit.
2,624,745,NOW(),Nullam quis arcu congue iaculis libero vitae porttitor nulla.
2,625,746,NOW(),Etiam blandit dui quis tortor placerat ut dictum neque ullamcorper.
2,626,747,NOW(),Cras imperdiet enim ut est condimentum posuere.
2,627,748,NOW(),Maecenas blandit velit eu volutpat tempus.
2,628,749,NOW(),Aliquam in elit ac ante euismod ultrices.
2,629,750,NOW(),Duis viverra leo eu enim porttitor malesuada.
2,630,751,NOW(),Etiam a nisi ultrices porttitor lacus ac pulvinar purus.
2,631,752,NOW(),Morbi interdum turpis eu maximus convallis.
2,632,753,NOW(),Nulla in mauris quis felis feugiat iaculis.
2,633,754,NOW(),Suspendisse vitae dui non ante dapibus pharetra vel et arcu.
2,634,755,NOW(),Nunc aliquet nulla vel interdum faucibus.
2,635,756,NOW(),Sed iaculis eros nec magna posuere non bibendum velit consequat.
2,636,757,NOW(),Aliquam iaculis lacus malesuada diam semper in dictum enim suscipit.
2,637,758,NOW(),Donec sollicitudin leo tincidunt ex dignissim et gravida nulla efficitur.
2,638,759,NOW(),Fusce et erat eu ipsum aliquam iaculis quis in nisi.
2,639,760,NOW(),Nam et ligula quis sapien aliquet sodales non eget augue.
2,640,761,NOW(),Nunc eleifend enim non porta venenatis.
2,641,762,NOW(),Nulla vel tortor vel diam euismod malesuada sit amet faucibus nisi.
2,642,763,NOW(),Mauris nec libero vitae elit maximus posuere at malesuada metus.
2,643,764,NOW(),Proin ac libero vitae mi fermentum laoreet eu id sapien.
2,644,765,NOW(),Donec ultrices arcu eget sem tristique at interdum tortor feugiat.
2,645,766,NOW(),Quisque vel ex pretium molestie justo sit amet pellentesque nulla.
2,646,767,NOW(),Nam imperdiet magna id commodo aliquet.
2,647,768,NOW(),Donec eget dui ut magna ullamcorper ornare.
2,648,769,NOW(),Nam suscipit justo nec felis iaculis vel pellentesque nisi egestas.
2,649,770,NOW(),Aliquam eget dolor fringilla lacus facilisis gravida id nec nulla.
2,650,771,NOW(),Vivamus et augue efficitur lobortis ligula non malesuada lacus.
2,651,772,NOW(),Pellentesque vel nisl id leo tincidunt laoreet.
2,652,773,NOW(),Donec rutrum lorem et nibh blandit fermentum.
2,653,774,NOW(),In in erat ut dolor pellentesque commodo dapibus at dui.
2,654,775,NOW(),Fusce eget nisl vitae neque aliquam gravida vitae vitae massa.
2,655,776,NOW(),Donec elementum lacus non ex viverra pharetra.
2,656,777,NOW(),Nam vitae lacus ac ex consequat luctus sit amet varius nisi.
2,657,778,NOW(),Integer viverra erat aliquet ex finibus ullamcorper.
2,658,779,NOW(),Nam at nulla non quam vulputate sagittis quis sit amet metus.
2,659,780,NOW(),Duis porta ligula nec imperdiet iaculis.
2,660,781,NOW(),Aliquam eu ipsum vitae augue accumsan hendrerit.
2,661,782,NOW(),Etiam et augue cursus tortor bibendum ultrices vitae consectetur leo.
2,662,783,NOW(),Nulla id dui rutrum est fermentum laoreet.
2,663,784,NOW(),Suspendisse rutrum purus quis dolor iaculis luctus.
2,664,785,NOW(),Nullam non ipsum ac sapien lacinia suscipit.
2,665,786,NOW(),Morbi nec orci eu enim porta tempus.
2,666,787,NOW(),Duis ornare mi vitae iaculis molestie.
2,667,788,NOW(),Morbi venenatis enim nec sapien maximus molestie.
2,668,789,NOW(),Sed in ligula ornare rhoncus neque vel sodales dolor.
2,669,790,NOW(),Aliquam ac neque vitae lacus auctor commodo.
2,670,791,NOW(),Nulla id mi ac massa vestibulum hendrerit.
2,671,792,NOW(),Proin nec dolor quis odio ultrices feugiat.
2,672,793,NOW(),Nullam congue quam nec velit fringilla id tincidunt justo vulputate.
2,673,794,NOW(),Vivamus blandit orci in ornare scelerisque.
2,674,795,NOW(),Nunc a sapien a lacus lobortis posuere.
2,675,796,NOW(),Maecenas laoreet nunc vitae lacinia vulputate.
2,676,797,NOW(),Curabitur condimentum ligula quis ipsum ullamcorper eleifend.
2,677,798,NOW(),Curabitur molestie tortor a justo vulputate tempor.
2,678,799,NOW(),Nulla convallis est ac ullamcorper suscipit.
2,679,800,NOW(),Donec ut magna luctus euismod risus a feugiat urna.
2,680,801,NOW(),Vivamus tincidunt metus sit amet justo pretium in ullamcorper tellus fringilla.
2,681,802,NOW(),Cras eget lacus non diam ultricies aliquet nec finibus mi.
2,682,803,NOW(),Sed malesuada erat faucibus porttitor euismod.
2,683,804,NOW(),Maecenas sagittis odio et mauris mollis tempor.
2,684,805,NOW(),Pellentesque id ex commodo commodo tortor luctus iaculis arcu.
2,685,806,NOW(),Curabitur at lectus viverra aliquet urna eu ultricies magna.
2,686,807,NOW(),Maecenas mattis tortor quis rhoncus tincidunt.
2,687,808,NOW(),Quisque eu mi tincidunt molestie velit quis suscipit libero.
