1,1,1,NOW(),Lorem ipsum dolor sit amet consectetur adipiscing elit.
1,2,2,NOW(),Fusce quis orci nec metus tincidunt porttitor id in metus.
1,3,3,NOW(),Morbi sit amet metus id felis blandit blandit eget ut lorem.
1,4,4,NOW(),Phasellus vel lorem sed mi venenatis tempor.
1,5,5,NOW(),Donec mollis lectus ac tempus dictum.
1,6,6,NOW(),Etiam vel ante nec neque consequat tincidunt et vel elit.
1,7,7,NOW(),Aenean iaculis velit vitae elementum dignissim.
1,8,8,NOW(),Phasellus eget nibh quis enim facilisis luctus.
1,9,9,NOW(),Vivamus sit amet massa gravida bibendum dolor nec ultricies nunc.
1,10,10,NOW(),Morbi ut turpis vitae odio scelerisque dapibus.
1,11,11,NOW(),Integer finibus dolor at sapien cursus aliquet.
1,12,12,NOW(),Curabitur eleifend quam vel quam eleifend consectetur.
1,13,13,NOW(),Mauris porttitor urna a ultrices ornare.
1,14,14,NOW(),Vivamus cursus dui vel est varius auctor.
1,15,15,NOW(),Nulla rutrum neque dapibus fermentum dolor a rutrum lectus.
1,16,16,NOW(),Nam tristique erat et risus volutpat porta egestas enim consequat.
1,17,17,NOW(),Aliquam varius lorem at ipsum bibendum a lacinia nisi porttitor.
1,18,18,NOW(),Integer euismod sem et efficitur mattis.
1,19,19,NOW(),Praesent dapibus nisi at risus convallis sit amet euismod magna bibendum.
1,20,20,NOW(),Pellentesque at mi in sapien aliquet ultrices ac vel mi.
1,21,21,NOW(),Vestibulum quis augue mollis iaculis enim vel eleifend nulla.
1,22,22,NOW(),Nullam vel neque eu turpis feugiat volutpat non ac elit.
1,23,23,NOW(),Curabitur id lectus et nisi finibus accumsan.
1,24,24,NOW(),Morbi ut tortor luctus ornare dui at dignissim magna.
1,25,25,NOW(),Aenean id eros in sem tincidunt eleifend.
1,26,26,NOW(),Phasellus bibendum erat nec lacus efficitur aliquet.
1,27,27,NOW(),Nunc at magna a magna dignissim fermentum.
1,28,28,NOW(),In id odio at eros tristique fermentum.
1,29,29,NOW(),Duis sit amet lectus hendrerit convallis elit sed fringilla risus.
1,30,30,NOW(),Phasellus dictum neque at venenatis blandit.
1,31,31,NOW(),Donec lacinia elit commodo magna tempus in vestibulum sem condimentum.
1,32,32,NOW(),Suspendisse pharetra libero non justo ornare convallis.
1,33,33,NOW(),Vestibulum et turpis a est rhoncus bibendum.
1,34,34,NOW(),Integer dignissim ex nec tellus semper in commodo felis euismod.
1,35,35,NOW(),Duis ultricies ipsum quis sagittis porta.
1,36,36,NOW(),Nulla laoreet nibh nec dolor eleifend convallis.
1,37,37,NOW(),Cras gravida erat quis augue finibus eleifend.
1,38,38,NOW(),Suspendisse sit amet diam malesuada ullamcorper enim sed sagittis libero.
1,39,39,NOW(),Maecenas tincidunt libero quis blandit luctus.
1,40,40,NOW(),Praesent at elit id eros ultricies dictum quis ac mauris.
1,41,41,NOW(),Vestibulum id tellus euismod vulputate magna id facilisis lectus.
1,42,42,NOW(),In varius diam sed odio tempus imperdiet.
1,43,43,NOW(),Aenean cursus enim vel lectus eleifend dignissim.
1,44,44,NOW(),Fusce aliquam tortor vitae odio aliquam ac lobortis arcu molestie.
1,45,45,NOW(),In sed metus sodales viverra enim ut luctus leo.
1,46,46,NOW(),Proin blandit erat at enim faucibus porttitor.
1,47,47,NOW(),Aliquam ultrices sapien ac lacus facilisis volutpat sit amet eu nisl.
1,48,48,NOW(),Aliquam in quam non risus finibus ultricies et non est.
1,49,49,NOW(),Duis posuere urna sed leo commodo gravida.
1,50,50,NOW(),In tincidunt urna vel ornare aliquam.
1,51,51,NOW(),Proin dapibus risus sed dictum cursus.
1,52,52,NOW(),Praesent et velit id nulla volutpat sagittis.
1,53,53,NOW(),Pellentesque sit amet est ultricies nisi faucibus cursus nec ut sem.
1,54,54,NOW(),Fusce eu libero non massa interdum sollicitudin.
1,55,55,NOW(),Proin laoreet risus eu magna sagittis malesuada.
1,56,56,NOW(),Proin volutpat massa a eros ultricies non fringilla purus cursus.
1,57,57,NOW(),Nullam commodo eros ut purus vulputate at semper lectus blandit.
1,58,58,NOW(),Proin hendrerit justo eget dui venenatis feugiat.
1,59,59,NOW(),Morbi vitae lectus et dui efficitur suscipit a at enim.
1,60,60,NOW(),Suspendisse a leo ut sapien lobortis tristique.
1,61,61,NOW(),Pellentesque at neque hendrerit tristique velit sit amet convallis lectus.
1,62,62,NOW(),Nam sit amet nulla interdum interdum risus ut congue mi.
1,63,63,NOW(),Sed sit amet enim feugiat laoreet est id elementum velit.
1,64,64,NOW(),Curabitur vitae nunc posuere tellus faucibus volutpat.
1,65,65,NOW(),Nunc hendrerit felis eu augue pellentesque nec placerat tortor bibendum.
1,66,66,NOW(),Proin imperdiet nunc ut eros tempus sed malesuada neque interdum.
1,67,67,NOW(),Nulla porta enim eget ex venenatis euismod.
1,68,68,NOW(),Phasellus non enim aliquet eleifend magna non faucibus urna.
1,69,69,NOW(),Maecenas sodales nisl non augue semper sit amet dictum urna suscipit.
1,70,70,NOW(),Suspendisse auctor ligula ut massa euismod sollicitudin ac ac ex.
1,71,71,NOW(),Aliquam at libero sit amet eros scelerisque rutrum et non lorem.
1,72,72,NOW(),Etiam ac tortor in dolor molestie accumsan nec quis justo.
1,73,73,NOW(),Sed sed dolor eu ex egestas aliquet at at leo.
1,74,74,NOW(),Donec eget ligula sed diam auctor hendrerit.
1,75,75,NOW(),Nullam ultricies urna quis tellus dignissim tempor.
1,76,76,NOW(),Donec sed tortor cursus dolor vestibulum rutrum eget et purus.
1,77,77,NOW(),Nulla non turpis gravida arcu sollicitudin suscipit vel vitae libero.
1,78,78,NOW(),Maecenas at felis ut justo aliquam efficitur id ac felis.
1,79,79,NOW(),Nullam vitae tortor sit amet nunc lobortis venenatis.
1,80,80,NOW(),Sed mattis lectus quis purus volutpat commodo.
1,81,81,NOW(),Fusce fringilla velit eu mauris malesuada rutrum.
1,82,82,NOW(),Nunc sed metus laoreet dictum diam eget dapibus augue.
1,83,83,NOW(),Ut in magna eget leo tincidunt maximus.
1,84,84,NOW(),Phasellus sollicitudin erat ut est euismod dapibus.
1,85,85,NOW(),Aliquam scelerisque lacus vel volutpat consectetur.
1,86,86,NOW(),Aenean fringilla diam non odio vehicula imperdiet.
1,87,87,NOW(),Etiam maximus nibh vitae lacus interdum vitae fringilla magna laoreet.
1,88,88,NOW(),Phasellus vitae enim ultrices sagittis lorem vitae dignissim leo.
1,89,89,NOW(),Pellentesque nec metus nec mauris porta auctor quis nec ligula.
1,90,90,NOW(),Curabitur euismod mi in velit finibus id commodo velit tincidunt.
1,91,91,NOW(),In vitae purus tempus nisi lacinia aliquam eget ac leo.
1,92,92,NOW(),Duis venenatis enim in mauris varius eu faucibus arcu maximus.
1,93,93,NOW(),Ut condimentum ex faucibus felis vestibulum at mattis nunc ornare.
1,94,94,NOW(),In in risus faucibus blandit velit quis condimentum ligula.
1,95,95,NOW(),Maecenas sit amet justo eu magna finibus commodo eu nec libero.
1,96,96,NOW(),Integer nec ante ac nulla laoreet feugiat.
1,97,97,NOW(),Duis ultricies nulla non purus dapibus a auctor ex dignissim.
1,98,98,NOW(),Curabitur sollicitudin risus et mattis sagittis.
1,99,99,NOW(),Pellentesque ut lacus quis lorem bibendum convallis.
1,100,100,NOW(),Praesent congue ligula quis mattis sollicitudin.
1,101,101,NOW(),Praesent vitae lorem et mauris ullamcorper rutrum vel eu urna.
1,102,102,NOW(),Integer eu lorem eu eros ultrices tristique quis eu nisi.
1,103,103,NOW(),Aliquam sit amet lectus in nunc consectetur facilisis.
1,104,104,NOW(),Nulla viverra lectus vitae sollicitudin interdum.
1,105,105,NOW(),Maecenas gravida enim sit amet orci imperdiet non maximus sapien venenatis.
1,106,106,NOW(),Nulla id eros ornare lobortis tortor id volutpat lacus.
1,107,107,NOW(),Nullam at odio eu sem luctus condimentum at quis metus.
1,108,108,NOW(),Sed vitae magna interdum pellentesque lectus at efficitur tortor.
1,109,109,NOW(),Ut mattis nunc eget dolor fermentum quis viverra tortor tincidunt.
1,110,110,NOW(),Integer malesuada orci pulvinar malesuada porttitor.
1,111,111,NOW(),Duis molestie turpis in nunc luctus ornare.
1,112,112,NOW(),Aliquam eu magna finibus mi hendrerit vestibulum.
1,113,113,NOW(),Donec condimentum erat a lobortis ullamcorper.
1,114,114,NOW(),In sed orci id nibh suscipit malesuada et nec massa.
1,115,115,NOW(),Nullam in risus id massa hendrerit tempor.
1,116,116,NOW(),Donec quis ligula molestie lobortis augue ut vestibulum enim.
1,117,117,NOW(),Etiam vitae justo volutpat vestibulum nunc vel pulvinar urna.
1,118,118,NOW(),Suspendisse et mi nec metus laoreet feugiat ut et magna.
1,119,119,NOW(),Vestibulum vitae elit vel tortor pretium cursus in fringilla sem.
1,120,120,NOW(),Donec vitae mauris eget elit vulputate ultrices a at ex.
1,121,121,NOW(),Mauris vel tortor tincidunt tempor magna in vestibulum dui.
1,122,122,NOW(),In laoreet metus ut urna maximus rhoncus ultricies tellus varius.
1,123,123,NOW(),Proin vitae est at nulla eleifend bibendum.
1,124,124,NOW(),Nam iaculis leo quis ex laoreet vel vulputate turpis bibendum.
1,125,125,NOW(),Sed non ante convallis risus laoreet luctus.
1,126,126,NOW(),Aliquam scelerisque turpis ut lacus blandit laoreet.
1,127,127,NOW(),In condimentum sem et dolor pulvinar ut porttitor mi semper.
1,128,128,NOW(),Maecenas vel diam scelerisque consectetur ante ut tempus augue.
1,129,129,NOW(),Donec eu dui molestie luctus augue a faucibus leo.
1,130,130,NOW(),Nulla ut mi cursus velit pellentesque molestie et nec ligula.
1,131,131,NOW(),Aenean consequat erat nec lectus placerat semper.
1,132,132,NOW(),Morbi non nunc molestie pellentesque ligula eget aliquet nisi.
1,133,133,NOW(),Aliquam dictum tellus auctor nisl finibus a vulputate nisi tempus.
1,134,134,NOW(),Proin eleifend arcu et volutpat vehicula.
1,135,135,NOW(),Nullam vel eros lobortis fermentum metus quis volutpat risus.
1,136,136,NOW(),Integer vitae sapien non nisi ultrices accumsan eu et orci.
1,137,137,NOW(),Aliquam mollis mi id neque ullamcorper pellentesque.
1,138,138,NOW(),Vestibulum vitae mi viverra fringilla quam vitae luctus ipsum.
1,139,139,NOW(),Nullam nec arcu vitae leo ultrices ornare.
1,140,140,NOW(),Curabitur ut augue eleifend volutpat lacus eu maximus mauris.
1,141,141,NOW(),Vivamus pharetra sem non pellentesque accumsan.
1,142,142,NOW(),Vestibulum gravida dui vitae mollis fermentum.
1,143,143,NOW(),Vivamus id elit ut est lobortis consequat.
1,144,144,NOW(),Aenean pretium orci et tortor maximus accumsan.
1,145,145,NOW(),Quisque vitae metus pulvinar iaculis augue et accumsan leo.
1,146,146,NOW(),Vestibulum pellentesque urna vel nulla maximus tempor.
1,147,147,NOW(),Quisque mollis odio nec nisi vestibulum ac convallis tortor faucibus.
1,148,148,NOW(),Vestibulum ac urna euismod eros facilisis iaculis eu in lectus.
1,149,149,NOW(),Praesent sed ipsum sed nunc posuere pharetra.
1,150,150,NOW(),Integer quis magna ut turpis rhoncus congue.
1,151,151,NOW(),Sed ac erat tincidunt nisl porta fringilla.
1,152,152,NOW(),Cras tristique turpis sit amet mauris tincidunt rhoncus.
1,153,153,NOW(),Pellentesque sodales quam ac orci pharetra efficitur.
1,154,154,NOW(),Praesent pretium massa eget velit facilisis sit amet consectetur urna fermentum.
1,155,155,NOW(),Vestibulum in tortor blandit sagittis erat a egestas turpis.
1,156,156,NOW(),Pellentesque in lorem pellentesque enim faucibus vulputate sed eu diam.
1,157,157,NOW(),In a justo consectetur dignissim massa ac feugiat arcu.
1,158,158,NOW(),Aliquam fermentum ipsum a arcu auctor efficitur.
1,159,159,NOW(),Vivamus a quam laoreet commodo urna non iaculis turpis.
1,160,160,NOW(),Vivamus id enim eu odio tristique imperdiet sit amet eget odio.
1,161,161,NOW(),Nullam gravida diam luctus tristique aliquam.
1,162,162,NOW(),Vestibulum cursus felis ac est eleifend eu cursus leo tempus.
1,163,163,NOW(),Aenean ornare nisl eget dui interdum iaculis.
1,164,164,NOW(),Suspendisse porttitor lectus nec mi pulvinar molestie.
1,165,165,NOW(),Donec sagittis libero a vehicula convallis.
1,166,166,NOW(),Ut sed sapien dapibus enim euismod rutrum.
1,167,167,NOW(),Duis quis ante eu diam molestie dapibus eu ut sapien.
1,168,168,NOW(),Suspendisse sit amet elit id velit semper volutpat.
1,169,169,NOW(),Praesent pulvinar enim elementum accumsan tellus id laoreet elit.
1,170,170,NOW(),Fusce at purus sit amet diam fermentum lobortis.
1,171,171,NOW(),Vivamus vestibulum elit fringilla placerat mi et euismod libero.
1,172,172,NOW(),Vivamus rhoncus risus a pulvinar rutrum.
1,173,173,NOW(),Phasellus vel urna sed urna venenatis cursus nec a lorem.
1,174,174,NOW(),Etiam ut orci et metus interdum tincidunt.
1,175,175,NOW(),Suspendisse ac orci in sapien ornare mollis in eget turpis.
1,176,176,NOW(),Praesent venenatis odio a mauris tincidunt auctor.
1,177,177,NOW(),Suspendisse elementum purus molestie justo imperdiet commodo.
1,178,178,NOW(),Pellentesque accumsan massa vel enim porttitor luctus.
1,179,179,NOW(),Mauris tempor nibh id blandit lacinia.
1,180,180,NOW(),Sed ullamcorper lorem in nisi tempor elementum.
1,181,181,NOW(),Maecenas quis arcu elementum eros ultrices egestas.
1,182,182,NOW(),In et sapien a arcu dictum egestas.
1,183,183,NOW(),Sed et odio vitae turpis lacinia finibus a id sapien.
1,184,184,NOW(),Cras vitae massa id purus dapibus sodales ac ut libero.
1,185,185,NOW(),Nam dignissim urna ac vehicula tincidunt.
1,186,186,NOW(),Vivamus a velit at arcu mollis vulputate convallis vitae tellus.
1,187,187,NOW(),Aenean eget eros ac leo hendrerit scelerisque bibendum ac tellus.
1,188,188,NOW(),Sed in magna ut orci porta ullamcorper vitae id justo.
1,189,189,NOW(),Vestibulum eget leo eget orci dapibus sagittis.
1,190,190,NOW(),Fusce volutpat magna in ornare dignissim.
1,191,191,NOW(),Nam vitae justo ut massa pulvinar vulputate.
1,192,192,NOW(),Sed auctor nisi non facilisis congue.
1,193,193,NOW(),Praesent ornare velit id justo blandit malesuada.
1,194,194,NOW(),Integer non dolor in quam mollis vulputate.
1,195,195,NOW(),Cras ac elit in diam blandit lobortis eget at libero.
1,196,196,NOW(),Cras faucibus odio ut nisi placerat in iaculis mauris tincidunt.
1,197,197,NOW(),Suspendisse efficitur urna nec consequat porta.
1,198,198,NOW(),Cras vestibulum urna vel mauris elementum id lobortis neque aliquet.
1,199,199,NOW(),Etiam sed diam porta ullamcorper tortor eu dignissim diam.
1,200,200,NOW(),Sed quis lectus a eros commodo tincidunt vitae et libero.
1,201,201,NOW(),Integer fringilla nisl ultrices odio blandit scelerisque.
1,202,202,NOW(),Ut in lorem vitae quam commodo cursus vel ut ante.
1,203,203,NOW(),Pellentesque tristique ligula a dolor luctus ultricies.
1,204,204,NOW(),Cras luctus justo at nisl sagittis sit amet vehicula mi euismod.
1,205,205,NOW(),Mauris vitae augue elementum vehicula velit id malesuada purus.
1,206,206,NOW(),Suspendisse vestibulum massa et nunc iaculis laoreet.
1,207,207,NOW(),Mauris sit amet odio iaculis accumsan nibh rhoncus viverra turpis.
1,208,208,NOW(),Praesent eu massa in odio consequat pulvinar at ut lectus.
1,209,209,NOW(),Phasellus ac ligula non justo egestas pulvinar.
1,210,210,NOW(),Morbi non odio quis sem volutpat commodo a et metus.
1,211,211,NOW(),Praesent condimentum leo vitae risus eleifend vitae volutpat massa scelerisque.
1,212,212,NOW(),Maecenas sit amet arcu quis eros accumsan varius.
1,213,213,NOW(),Vivamus sed ipsum semper pulvinar ante vitae condimentum sapien.
1,214,214,NOW(),Sed rhoncus urna ultricies ultricies odio at facilisis turpis.
1,215,215,NOW(),Donec suscipit erat eget ullamcorper volutpat.
1,216,216,NOW(),Vestibulum et augue eu dolor ornare placerat quis id dolor.
1,217,217,NOW(),Duis sollicitudin dolor vel ex mattis congue.
1,218,218,NOW(),Etiam porttitor sapien convallis placerat aliquet.
1,219,219,NOW(),Donec mollis leo eu tempor aliquam.
1,220,220,NOW(),In ut mi feugiat accumsan orci a aliquet arcu.
1,221,221,NOW(),Sed in massa vehicula est viverra commodo.
1,222,222,NOW(),Praesent suscipit magna imperdiet aliquam molestie.
1,223,223,NOW(),Integer laoreet lectus sit amet enim bibendum sit amet posuere arcu volutpat.
1,224,224,NOW(),Nam eu turpis quis urna euismod pretium.
1,225,225,NOW(),Morbi quis mauris vel lacus rhoncus tempus.
1,226,226,NOW(),Donec ut massa nec dui ultricies egestas nec eget magna.
1,227,227,NOW(),Donec laoreet orci vel elit fermentum tincidunt.
1,228,228,NOW(),Nullam quis augue vitae ante rhoncus facilisis.
1,229,229,NOW(),Duis vitae risus sit amet massa placerat congue.
1,230,230,NOW(),Donec rhoncus quam id eros sollicitudin sollicitudin.
1,231,231,NOW(),Ut auctor metus a posuere tempus.
1,232,232,NOW(),Duis porta quam nec consequat elementum.
1,233,233,NOW(),In quis mauris a urna tincidunt convallis a ac massa.
1,234,234,NOW(),Aliquam id justo quis ipsum ultrices fermentum in eu quam.
1,235,235,NOW(),Nulla tincidunt velit nec nibh consequat facilisis.
1,236,236,NOW(),Pellentesque eget massa eu mi convallis tempus.
1,237,237,NOW(),Phasellus id nibh ut justo consequat scelerisque.
1,238,238,NOW(),Sed facilisis dolor at diam interdum iaculis.
1,239,239,NOW(),Duis in nulla non quam viverra eleifend sagittis at lectus.
1,240,240,NOW(),Pellentesque scelerisque eros in ullamcorper convallis.
1,241,241,NOW(),Ut mattis magna sit amet accumsan laoreet.
1,242,242,NOW(),Proin sagittis mauris mollis lacus consectetur consectetur.
1,243,243,NOW(),Nullam consectetur nisl vel nisi dictum sit amet vehicula nulla imperdiet.
1,244,244,NOW(),Nulla mattis augue hendrerit elit pharetra ut lobortis erat congue.
1,245,245,NOW(),Nulla tincidunt dui volutpat faucibus urna nec egestas lectus.
1,246,246,NOW(),Sed vel tortor eu nulla iaculis tincidunt ac eu lacus.
1,247,247,NOW(),Mauris porttitor dolor ut nulla facilisis sollicitudin.
1,248,248,NOW(),Pellentesque ac est vitae elit vulputate sagittis.
1,249,249,NOW(),Pellentesque rhoncus risus vel varius semper.
1,250,250,NOW(),Mauris commodo sem in dui sollicitudin non elementum dolor accumsan.
1,251,251,NOW(),Mauris id ipsum pellentesque porttitor quam at ultrices leo.
1,252,252,NOW(),Donec scelerisque leo eget tempor posuere.
1,253,253,NOW(),Suspendisse a nisi eu eros ultrices porttitor.
1,254,254,NOW(),Morbi cursus libero a accumsan molestie.
1,255,255,NOW(),Donec ut urna fringilla egestas massa vel fermentum diam.
1,256,256,NOW(),Maecenas aliquam lorem ut pharetra mattis.
1,257,257,NOW(),Phasellus sit amet velit suscipit nisl faucibus molestie quis eu dolor.
1,258,258,NOW(),In in mauris at nunc mollis sodales.
1,259,259,NOW(),Nullam id est placerat hendrerit justo at pellentesque nibh.
1,260,260,NOW(),Aliquam sed dui quis velit finibus aliquam imperdiet eget purus.
1,261,261,NOW(),Integer ultricies massa id eleifend rutrum.
1,262,262,NOW(),Nunc ultrices dolor vulputate euismod ex ut maximus augue.
1,263,263,NOW(),Etiam quis tortor eget diam viverra imperdiet.
1,264,264,NOW(),Donec nec erat in nibh aliquet accumsan.
1,265,265,NOW(),Nunc sed purus a nunc fermentum tincidunt.
1,266,266,NOW(),Morbi cursus eros vel ex fringilla dignissim.
1,267,267,NOW(),Pellentesque in odio pellentesque congue ante quis suscipit lorem.
1,268,268,NOW(),Fusce eu purus porta quam ornare tristique at vitae ante.
1,269,269,NOW(),Vivamus vulputate ligula nec ante rhoncus nec fermentum dolor pellentesque.
1,270,270,NOW(),In dictum libero sed ipsum commodo vitae condimentum tellus pharetra.
1,271,271,NOW(),Nullam et felis ut lectus dapibus mollis in ut nunc.
1,272,272,NOW(),Ut aliquam lorem nec sem blandit nec pretium risus pretium.
1,273,273,NOW(),Morbi ullamcorper dolor at luctus iaculis.
1,274,274,NOW(),Morbi eu erat sit amet felis scelerisque lacinia.
1,275,275,NOW(),Fusce molestie est non erat molestie sodales eget non arcu.
1,276,276,NOW(),Phasellus eu mauris nec nunc molestie feugiat id sit amet mi.
1,277,277,NOW(),Etiam vehicula nibh non augue rutrum lobortis.
1,278,278,NOW(),Morbi tristique lectus id molestie dignissim.
1,279,279,NOW(),Nam quis erat elementum interdum leo sed cursus nulla.
1,280,280,NOW(),Donec sed risus nec ipsum imperdiet iaculis eget ut lorem.
1,281,281,NOW(),Maecenas tempor odio vel ex sagittis sit amet vestibulum nulla gravida.
1,282,282,NOW(),Quisque fringilla libero ut ante efficitur eleifend.
1,283,283,NOW(),In condimentum sem ut ex lacinia ultricies.
1,284,284,NOW(),Mauris eleifend enim id augue pretium tristique.
1,285,285,NOW(),Aliquam faucibus mauris et risus interdum bibendum.
1,286,286,NOW(),Pellentesque ut metus in tortor vehicula bibendum.
1,287,287,NOW(),Donec dictum orci quis sapien porttitor ac dignissim neque ultricies.
1,288,288,NOW(),Nulla vestibulum tortor et semper faucibus.
1,289,289,NOW(),Nulla eu nibh at elit sodales fermentum.
1,290,290,NOW(),Nunc sit amet ipsum in nibh luctus condimentum.
1,291,291,NOW(),Phasellus pellentesque nisi at sollicitudin tempor.
1,292,292,NOW(),Cras consequat leo nec arcu dignissim malesuada.
1,293,293,NOW(),Proin ac purus quis magna efficitur vehicula.
1,294,294,NOW(),Vestibulum sit amet mi maximus accumsan felis non iaculis sapien.
1,295,295,NOW(),Proin a turpis eu lectus bibendum commodo.
1,296,296,NOW(),In nec diam cursus scelerisque sapien posuere malesuada leo.
1,297,297,NOW(),Fusce ultrices nisi eu pharetra sodales.
1,298,298,NOW(),Nunc at elit in erat congue fermentum sodales a odio.
1,299,299,NOW(),Nam eleifend sapien sed facilisis eleifend.
1,300,300,NOW(),Praesent dictum est eget erat semper vitae pellentesque diam egestas.
1,301,301,NOW(),Mauris tristique justo ac hendrerit cursus.
1,302,302,NOW(),Curabitur facilisis dui vitae maximus efficitur.
1,303,303,NOW(),Curabitur convallis lorem in lorem rhoncus auctor.
1,304,304,NOW(),Donec commodo quam at cursus tincidunt.
1,305,305,NOW(),Pellentesque porttitor arcu commodo sapien faucibus porttitor.
1,306,306,NOW(),Vestibulum sodales lorem vitae libero porttitor aliquet.
1,307,307,NOW(),Fusce ultricies nibh id tortor aliquet tristique.
1,308,308,NOW(),Ut et quam dictum interdum nisl ultricies sodales tellus.
1,309,309,NOW(),Aliquam nec tellus non ante pulvinar luctus.
1,310,310,NOW(),Phasellus at tellus tincidunt lectus hendrerit fringilla eget id arcu.
1,311,311,NOW(),Pellentesque vitae sapien sed nunc elementum tristique lobortis et eros.
1,312,312,NOW(),Proin non odio pharetra commodo lorem eget ullamcorper velit.
1,313,313,NOW(),Morbi ac tellus id tortor vehicula dictum sit amet sollicitudin quam.
1,314,314,NOW(),Curabitur sed leo non diam vehicula aliquam.
1,315,315,NOW(),Mauris condimentum lacus sit amet purus tincidunt pretium.
1,316,316,NOW(),Integer sit amet mi non lectus ultricies consequat eu in ligula.
1,317,317,NOW(),Fusce eget neque elementum auctor ante at dictum enim.
1,318,318,NOW(),Maecenas mollis risus ut dui vehicula vehicula.
1,319,319,NOW(),Pellentesque dictum nibh sed nunc hendrerit scelerisque.
1,320,320,NOW(),Maecenas vel massa lobortis vestibulum dui ut dictum diam.
1,321,321,NOW(),Nunc sodales arcu a neque pulvinar aliquam.
1,322,322,NOW(),Vestibulum venenatis diam non euismod sagittis.
1,323,323,NOW(),Curabitur sed urna vel leo convallis mollis.
1,324,324,NOW(),Vestibulum a ex ut velit vulputate ornare et facilisis justo.
1,325,325,NOW(),Mauris efficitur lacus sed nisl vulputate a commodo velit suscipit.
1,326,326,NOW(),Donec nec tortor dictum tempor ex tempor condimentum quam.
1,327,327,NOW(),Vivamus gravida orci sit amet neque iaculis id finibus augue rhoncus.
1,328,328,NOW(),Aenean volutpat quam in condimentum placerat.
1,329,329,NOW(),Cras eu velit a nulla ornare tincidunt ac non dui.
1,330,330,NOW(),Sed scelerisque diam vel mattis posuere.
1,331,331,NOW(),Morbi maximus massa pharetra sollicitudin lobortis.
1,332,332,NOW(),Suspendisse cursus eros feugiat sem sodales consectetur.
1,333,333,NOW(),Cras ut dolor feugiat dui pellentesque finibus vel nec dolor.
1,334,334,NOW(),Nunc et erat vel tellus tempor bibendum.
1,335,335,NOW(),Donec sed dolor nec ex sollicitudin tristique auctor ut erat.
1,336,336,NOW(),Fusce ullamcorper libero eget malesuada volutpat.
1,337,337,NOW(),Fusce sit amet nibh fringilla bibendum leo pretium eleifend libero.
1,338,338,NOW(),Vestibulum vel velit eget libero rhoncus porttitor ac sodales augue.
1,339,339,NOW(),Mauris ac erat quis quam vulputate malesuada id eget libero.
1,340,340,NOW(),Suspendisse porttitor tellus suscipit euismod mattis.
1,341,341,NOW(),Praesent ac est tempor pretium leo vel blandit erat.
1,342,342,NOW(),Aenean pellentesque elit commodo nibh interdum pellentesque.
1,343,343,NOW(),Vivamus tincidunt erat sed leo sagittis pulvinar.
1,344,344,NOW(),Morbi eu ipsum nec mauris auctor rutrum in quis elit.
1,345,345,NOW(),Sed ullamcorper dui sed est eleifend varius in in ante.
1,346,346,NOW(),Sed sagittis nibh non libero sagittis tempor.
1,347,347,NOW(),Mauris sed ipsum et est interdum luctus eu ut enim.
1,348,348,NOW(),Ut at velit tristique finibus sem sit amet cursus tellus.
1,349,349,NOW(),Mauris nec lorem fermentum egestas diam sed feugiat massa.
1,350,350,NOW(),Nulla convallis enim sit amet ultrices sagittis.
1,351,351,NOW(),Sed a justo non tortor vestibulum venenatis.
1,352,352,NOW(),Duis pharetra nisl quis ex vehicula non convallis erat pulvinar.
1,353,353,NOW(),Integer et mauris lobortis dui lobortis aliquet.
1,354,354,NOW(),Etiam ornare velit sed nisi tristique posuere.
1,355,355,NOW(),Ut pulvinar diam in dui pulvinar vel posuere lacus varius.
1,356,356,NOW(),In non neque molestie hendrerit lectus id semper ante.
1,357,357,NOW(),In nec nisl id justo lacinia maximus.
1,358,358,NOW(),Maecenas sit amet lectus ac dolor luctus laoreet ac id velit.
1,359,359,NOW(),Donec id nulla rhoncus gravida sem vitae suscipit tellus.
1,360,360,NOW(),Phasellus at lorem quis neque congue molestie.
1,361,361,NOW(),Curabitur eu nulla tincidunt posuere elit molestie posuere ex.
1,362,362,NOW(),Vestibulum at eros tempor pharetra libero eu tempor enim.
1,363,363,NOW(),Nunc sagittis nulla at lobortis ultrices.
1,364,364,NOW(),Donec facilisis orci et blandit scelerisque.
1,365,365,NOW(),Nullam vitae turpis hendrerit semper tortor sed malesuada enim.
